会社名,URL,住所,お問合せURL
中川幸治税理士事務所,https://oka-nakagawa.tkcnf.com/,岡山県岡山市中区穝29番地1サンハウスNAKATA　B棟,https://oka-nakagawa.tkcnf.com/form/oka-nakagawa/contact
税理士法人 名南経営,http://www.meinan.net/,愛知県名古屋市中村区名駅一丁目1番1号 JPタワー名古屋33階,https://www.meinan.net/contact
明和マネジメント税理士法人,http://www.meiwa-m.co.jp/,大阪府大阪市北区西天満5-16-3　西天満ファイブビル6階,https://www.meiwa-m.co.jp/
ひかり税理士法人,http://www.takahashi.co.jp/,群馬県高崎市問屋町4-7-8 高橋税経ビル,https://takahashi.co.jp/contact
税理士法人とおやま,http://www.to-yama.com/,東京都新宿区高田馬場1-31-18 高田馬場センタービル6F,https://www.to-yama.com/contact/
株式会社グローバル・コーポレート・コンサルティング,http://www.g-c-c.jp/,大阪府大阪市中央区安土町2丁目3-13大阪国際ビルディング20F,https://www.g-c-c.jp/contact/
長澤税理士事務所,http://www.tax1040nagasawa.com/,東京都千代田区内神田1-17-8 内神田ビル　3Ｆ,https://www.tax1040nagasawa.com/inquiry/
須田裕行税理士事務所,http://www.suda.gr.jp/,東京都武蔵野市中町1-16-10日本生命武蔵野ビル5F,https://www.sudatax.net/contact/
仲村公認会計士事務所,http://www.cpa-nakamura.com/,千葉県千葉市中央区本町１丁目４－２４,https://www.cpa-nakamura.com/07otoi/index.htm
柳和弘税理士事務所,http://www.yanagikaikei.jp/,愛知県名古屋市北区水切町3-45,https://www.yanagikaikei.jp/category/1184216.html
税理士法人今仲清事務所,http://www.imanaka-kaikei.co.jp/,大阪府堺市北区長曽根町3077番地3 Feliseed中百舌鳥,https://www.imanaka-kaikei.co.jp/contact
山條隆史税理士事務所,http://www.yamajo-tax.com/,東京都目黒区中央町2丁目7番5号ロイヤルエクセレント学芸大501号,https://www.yamajo-tax.com/form.html
桂 会計事務所,http://kkj-net.com/,愛知県名古屋市緑区鳴海町字薬師山126-1,https://kkj-net.com/html/page03.html#job03
税理士法人 グッドパートナーズ会計事務所,http://www.gpkaikei.jp/,岐阜県羽島郡岐南町下印食３丁目30番地　とらでんビル１階,https://www.gpkaikei.jp/contact/index.html
川島税理士事務所,https://www.kawashima-office.jp/,東京都中央区八丁堀４－１２－７サニービル４Ｃ,https://www.kawashima-office.jp/category/1155998.html
平井英長税理士事務所,http://hirai-taxacc.com,神奈川県相模原市中央区中央2-3-19,https://hiraitaxacc.mimoza.jp/inquiry/
かまた税理士法人,http://www.kamata-kaikei.com/,東京都千代田区内神田２－２－６　田中ビル２F,https://www.kamata-kaikei.com/contact.html
KT-Solutions,http://kt-sol.com/,福岡県福岡市早良区百道浜3-8-33福岡システムLSI総合開発センター503,https://kt-sol.com/mailform/
税理士法人タックス総合経営研究所,http://www.tax-soken.or.jp/,北海道釧路市南大通3丁目1番10号,https://www.tax-soken.or.jp/contact/
株式会社小野経営サポート,http://www.onoks.co.jp/,茨城県水戸市五軒町1-3-34　会計ビル,https://onoks.co.jp/contact/
芝会計事務所,http://www.shiba-kaikei.com/,東京都港区芝3-4-11芝シティビル2F,https://www.shiba-kaikei.com/email/
西山会計事務所,http://www.nishiyamakaikei.com/,東京都東久留米市本町1-5-4 ハイムＳＹ２０２,https://www.nishiyamakaikei.com/form/nishiyamakaikeicom/inquiry
仲谷陽子税理士事務所,http://www.nakayakaikei.com/,愛知県田原市東赤石4-10 2階,https://www.nakayakaikei.com/form/nakayakaikeicom/inquiry
村松・酒井税理士法人,http://www.smc-ao.com/,静岡県浜松市浜北区新原２８９２-５,https://www.smc-ao.com/form/smc-aocom/inquiry
税理士法人野中会計事務所,http://www.nonaka-kaikei.com/,静岡県島田市南1-13-1,https://www.nonaka-kaikei.com/form/nonaka-kaikeicom/inquiry
公認会計士・税理士水越会計事務所,http://www.mizukoshi-office.com/,大阪府大阪市住之江区粉浜3丁目11番13号,https://mizukoshi-office.com/contact/
松川聡美税理士事務所,http://www.satomi-office.com/,福井県福井市志比口1-12-27シヒグチビル2階　5号室,https://www.satomi-office.com/form/satomi-officecom/inquiry
和田会計事務所,http://wada-kaikei.net/,岡山県岡山市北区下中野356-101,https://wada-kaikei.net/contact/
税理士法人 松田会計,http://www.matsuda-zeirishi.com/,福岡県福岡市博多区博多駅前4-20-23　セントラルビル2F,https://www.matsuda-zeirishi.com/form/matsuda-zeirishicom/inquiry
株式会社 サハラプラス会計　佐原税理士・行政書士事務所,http://www.sahara-plus.info/,長崎県長崎市中町5番23号 大久保中町第二ビル 701号,https://www.sahara-plus.info/sozoku
税理士法人日隈パートナーズ,https://hinokuma.com/,熊本県熊本市東区尾ノ上1丁目25-20 オノウエビル2F,https://hinokuma.com/information/
イタクグループ,https://itac-group.jp/,沖縄県那覇市古島1-4-9,https://itac-group.jp/contact/
税理士法人 アプロ,http://www.aplo-tax.com/,鹿児島県鹿児島市平之町１３－４１オーシャンズタワーＳＴ１７　１２０１,https://www.aplo-tax.com/form/aplo-taxcom/inquiry
日野上会計グループ,http://www.hinokami.co.jp/,大阪府大阪市平野区平野本町5丁目14番20号　日野上ビル5F,https://www.hinokami.co.jp/form/hinokami/inquiry
税理士法人　田中会計事務所,http://www.tanaka-kaikei.or.jp/,北海道札幌市中央区大通西11丁目4番地175TK大通ビル,https://www.tanaka-kaikei.or.jp/form/tanaka-kaikeiorjp/contact
三八城税理士法人,http://www.a-miyagi.jp/,青森県八戸市内丸1丁目1番47号,https://www.a-miyagi.jp/contact/
水口(みなくち）税理士事務所,http://minakuchi-acg.biz/,宮城県仙台市若林区中倉1丁目5番19号,https://www.minakuchi-acg.biz/%E3%81%8A%E5%95%8F%E3%81%84%E5%90%88%E3%82%8F%E3%81%9B
及川会計事務所,http://oikawakaikei.web.fc2.com/,宮城県仙台市青葉区上杉3丁目3-21上杉NSビル4A,https://oikawakaikei.web.fc2.com/consulting/consulting.html
有限会社エーアイティ研究所,https://www.ait-labo.com/,福島県本宮市本宮字小原田200-2,https://www.ait-labo.com/contact/
鈴木隆司税理士事務所,http://www.tkcsuzukikaikei-lemans.com/,福島県白河市外薄葉15-1,https://www.tkcsuzukikaikei-lemans.com/form/tkcsuzukikaikei-lemanscom/inquiry
税理士法人モザワ事務所,http://www.tax-mozawa.com/pc/,新潟県長岡市川崎町568番地5,https://www.tax-mozawa.com/form/tax-mozawacom/inquiry
税理士法人飯島会計事務所,http://www.iijimakaikei.com/,群馬県太田市龍舞町5397,https://www.iijimakaikei.com/consultation
森会計事務所,http://www.mori-actg.com,栃木県足利市有楽町840番地,https://mori-actg.com/mail/
税理士法人柴会計事務所,http://www.shibakaikei.jp/pc/,栃木県真岡市並木町3-11-10,https://www.shibakaikei.jp/form/shibakaikeijp/inquiry
依田会計グループ,http://www.yodacpa.co.jp/,東京都新宿区西新宿7-11-18　711ビル4Ｆ,https://www.yodacpa.co.jp/form/yodacpa/mail
松本浩幸税理士事務所,http://zeirishi-matsumoto.com/,東京都新宿区新宿1-5-6 156御苑ビル4階,https://www.zeirishi-matsumoto.com/contact/contact.html
小見山公認会計士事務所,http://www.komiyama-cpa.com/,東京都港区六本木3-6-9 K2ビル,https://komiyama-cpa.com/company/contact
税理士法人TGN東京,https://www.tgn-tokyo.jp/,東京都港区西新橋3-6-10マストライフ西新橋ビル4F,https://www.tgn-tokyo.jp/form/kirameki-taxjp/contact
大津留税務会計事務所,http://www.otsuru-net.co.jp/,東京都江戸川区南篠崎町2-10-7 渡辺ビル4F,https://www.otsuru-net.co.jp/form/otsuru-netcojp/contact
税理士法人スガイ会計,http://www.sugaikaikei.com/,東京都足立区西新井本町5丁目8番12号 西新井セントラルハイム404号,https://www.sugaikaikei.com/form/sugaikaikeicom/inquiry
東京セントラル税理士法人,http://www.tokyo-central.com/,東京都江戸川区南篠崎町3-14-7,https://www.tokyo-central.com/form/tokyo-central/inquiry
兵頭税務会計事務所,http://www.hyodo-ao.com/,東京都新宿区四谷三栄町２番１号 第一萬寿ビル301,https://www.hyodo-ao.com/work_succession
加藤公認会計士・税理士事務所,http://www.kato-co.jp/,東京都港区赤坂3-2-2 日総第24ビル6階,https://www.kato-co.jp/category/743703.html
尾崎税理士事務所,http://ozaki-zeimu.com/,東京都中央区日本橋兜町19-8八重洲ＫＨビル4階,https://ozaki-zeimu.com/toiawase1/
横山税理士事務所,http://www.y-zeirishi.com/,東京都江⼾川区東葛⻄6-1-13 ラフォーレⅡ403,https://y-zeirishi.com/contact/
本間正樹税理士事務所,http://www.honmazeiri.com/,東京都豊島区駒込3-2-7デュアル駒込7階,https://www.honmazeiri.com/form/honmazeiricom/inquiry
山下明宏税理士事務所,https://www.ac-yamashita.jp/,東京都新宿区西新宿7-5-8 GOWA西新宿1F,https://www.ac-yamashita.jp/form/ac-yamashitajp/inquiry
花岡税務会計事務所,http://www.hanaokazeimukaikei.com/,東京都府中市寿町1-8-1　寿町KYビル4Ｆ,https://www.hanaokazeimukaikei.com/form/hanaokazeimukaikeicom/inquiry
SMC税理士法人,https://www.smcjapan.co.jp/,日吉町18-26　所沢FSビル5F,https://www.smcjapan.co.jp/contact/
久保田会計事務所,http://www.kubotakaikei.com/,神奈川県川崎市川崎区大師駅前2-8-8,https://www.kubotakaikei.com/contact.html
佐藤税務会計事務所,http://www.sato-accounting-firm.com/,神奈川県川崎市麻生区万福寺1丁目1番1号新百合ヶ丘シティビルディング1階,https://www.sato-accounting-firm.com/contact/
税理士法人シンワ綜合税務,http://www.shinwa-tax.jp/,神奈川県横浜市西区北幸2-9-10 横浜HSビル4F,https://www.shinwa-tax.jp/contact.html
岡野相続税理士法人,https://www.souzoku-zei.jp/,神奈川県横浜市新横浜3-7-18 日総第18ビル9F,https://www.souzoku-zei.jp/contact/inquiry/
小溝税務会計事務所,http://www.komizokaikei.com/,千葉県柏市あけぼの4-4-2,https://www.komizokaikei.com/form/komizokaikeicom/inquiry
田口仁税理士事務所,http://www.tax-taguchi.com/,千葉県柏市柏3-7-26,https://www.tax-taguchi.com/form/tax-taguchicom/inquiry
田仲賢一税理士事務所,http://www.ken-tax-account.com/,千葉県船橋市西習志野1-9-8,https://www.ken-tax-account.com/form/ken-tax-accountcom/inquiry
小林修税理士事務所,http://www.sk-support.co.jp/,埼玉県川口市西青木5丁目8−16,https://sk-support.co.jp/contact.html
加藤忠男税理士事務所,http://www.katou-zeiri.com/,埼玉県蕨市中央1-26-1 T-1ビル301号,https://www.katou-zeiri.com/form/katou-zeiricom/inquiry
河野直行税理士事務所,http://www.konokaikei.com/,埼玉県さいたま市北区宮原町3-166 岩崎ビル2F,https://www.konokaikei.com/form/konokaikeicom/inquiry
小林税理士事務所,http://www.kobazei.com/,埼玉県川越市下広谷1165,https://www.kobazei.com/form/kobazeicom/contact
MMPC税理士法人,http://www.matui.net/,愛知県名古屋市中区錦1-6-17オリジン錦2F,https://www.matui.net/form/matuinet/inquiry
木村会計事務所,http://www.kimura-kaikei.biz/,愛知県名古屋市中川区高畑2丁目326番地,https://www.kimura-kaikei.biz/form/kimura-kaikeibiz/inquiry
浅野裕久税理士事務所,http://www.h-asano.jp/,愛知県名古屋市中川区中郷1-56-2,https://www.h-asano.jp/form/h-asanojp/inquiry
税理士法人 伊勢山会計,http://www.iseyama.com/,愛知県名古屋市中区古渡町18-9 TSUNOKYU名古屋ビル5階,https://www.iseyama.com/contact/
渡辺儀春会計事務所,http://www.tax-yoshiharu.com/,山梨県富士吉田市下吉田2-24-27,https://www.tax-yoshiharu.com/form/tax-yoshiharucom/inquiry
ひばり税理士法人,http://www.hibari.biz/,静岡県田方郡函南町塚本940-4,https://hibari.biz/service#tab01
安井聡彦税理士事務所,http://www.yasuikaikei.jp/,愛知県西尾市丁田町上ノ切2-3,https://www.yasuikaikei.jp/contact
有限会社オフィス大手　渡部薫夫税理士・行政書士事務所,http://www.office-ote.com/,愛知県刈谷市大手町1-50,https://www.office-ote.com/contact/
河合会計事務所,http://www.kawai-ac.com/,岐阜県大垣市林町5丁目38番地　グランアクア2階,https://www.kawai-ac.com/form/kawai-accom/contact
税理士法人 タスクマネジメント,http://www.task-mg.com/,愛知県名古屋市千種区池下1-3-5,https://www.task-mg.com/form/task-mgcom/inquiry
荒木千恵子税理士事務所,http://www.akaikei.jp/,三重県四日市市大字茂福536番地4,https://www.akaikei.jp/form/akaikei/contact
おぎ堂会計事務所,http://www.m-ogido.com/,大阪府大阪市平野区背戸口5丁目6番24号 おぎ堂ビル,https://www.m-ogido.com/businesses/stream/
斎藤税理士事務所,http://www.saito-zei.com/,大阪府大阪市東成区中道3丁目15番16号 毎日東ビル6階,https://saito-zei.com/contact/
こでら会計事務所,http://www.kodera-office.com/,大阪府大阪市城東区関目1丁目14番27－2号,https://www.kodera-office.com/form/kodera-officecom/tkc-online-consultation
孔明会計事務所,http://www.tioffice.jp/,大阪府泉南市信達牧野415-3,https://www.tioffice.jp/form/tiofficejp/inquiry
税理士法人川邑・中合同会計事務所,http://www.kawamura-m.com/,和歌山県和歌山市湊通丁北４丁目40番地,https://www.kawamura-m.com/contact/
溝口税理士事務所,http://www.ee-tax.net/,京都府京都市西京区山田大吉見町18-5桂平安マンション116,http://www.ee-tax.net/info/inquiry.html
竹内久明税理士事務所,http://www.takeuchi-tax.net/,京都府京都市左京区岩倉幡枝町７８５－１０９,https://www.takeuchi-tax.net/form/takeuchi-taxnet/inquiry
アイマーク税理士法人,http://www.i-mark.jp/,京都府京都市山科区勧修寺平田町２番地,https://www.i-mark.jp/recruit.php#contact
巴山会計事務所,http://www.hayama-taxoffice.com/,京都府久世郡久御山大字島田小字堤外25番地15,https://www.hayama-taxoffice.com/form/hayama-taxofficecom/inquiry
公認会計士村上博保事務所,http://www.cpa-murakami.jp/,京都府京都市伏見区深草平田町13-17,https://www.cpa-murakami.jp/form/cpa-murakami/contact
神戸中央会計事務所,http://tax-kobear.p-kit.com/,兵庫県神戸市中央区多聞通2丁目4-4　ﾌﾞｯｸﾛｰﾝ神戸ビル東館3階,https://tax-kobear.p-kit.com/usermail/index.php?id=94960
村上純二公認会計士・税理士事務所,http://www.jun2murakami.com/,兵庫県神戸市中央区播磨町49番地　神戸旧居留地平和ビル6F,https://www.jun2murakami.com/form/jun2murakamicom/inquiry
井上浩志税理士事務所,http://www.inoue-kaikei.net/,兵庫県姫路市東延末５丁目３４−２,https://www.inoue-kaikei.net/form/inoue-kaikeinet/inquiry
荒神五師税理士事務所,http://www.aladdin-lamp.jp/,広島県広島市南区比治山本町16-58河田ビル3F,https://www.aladdin-lamp.jp/form/aladdin-lampjp/inquiry
桝井 税理士事務所,http://www.masui-zeirishi.com/,広島県広島市西区横川町2丁目9-18　房尾本店ビル201,https://www.masui-zeirishi.com/form/masui-zeirishicom/inquiry
石井達美税理士事務所,http://www.tatch15.jp/,山口県下関市田倉689,https://www.tatch15.jp/form/tatch15jp/inquiry
税理士法人　ゆいまーる,http://www.yuima-lu.jp/,山口県周南市新宿通り二丁目２２番地,https://www.yuima-lu.jp/tkc-management-qa
河野会計事務所　有限会社UBC経営,http://www.ubc-net.com/,山口県宇部市北琴芝1丁目6−10,https://www.ubc-net.com/contact/
三宅雅宣税理士事務所,https://www.miyake-kaikei.com/,岡山県岡山市北区伊島町1丁目2番5号,https://www.miyake-kaikei.com/form/miyake-kaikeicom/inquiry
木原税理士法人,http://www.ykj.jp/,福岡県福岡市中央区大名2-4-22　新日本ビル5F,https://ykj.jp/contact/
古川直樹税理士事務所,http://www.furukawa-tax.com/,福岡県北九州市八幡西区筒井町１２－２１,https://www.furukawa-tax.com/form/furukawa-taxcom/inquiry
坂田会計事務所,http://www.sakata-kaikei.jp/,東京都台東区台東4丁目31番6号　SAKATA BLD.,https://www.sakata-kaikei.jp/counsel.html
ＲＩＴＡ税理士法人,http://www.yamamikaikei.jp/,北海道札幌市中央区南4条東2丁目　12番地3　川村ビル5階,https://www.yamamikaikei.jp/form/yamamikaikeijp/contact
税理士法人川島総合事務所,http://www.kawashima-sogo.com/,大阪府大阪市中央区内淡路町1丁目2番9号　中谷ビル501号,https://mushinkoku.com/contact
湯谷和彦税理士事務所,http://www.yutani-tax.com/,北海道苫小牧市元中野町4丁目3-14　MSCオフィスビル2F,https://www.yutani-tax.com/form/yutani-taxcom/contact
税理士法人 大沼田経営会計事務所,http://www.oonumata.or.jp/,長野県塩尻市大門桔梗町6番17号,https://www.oonumata.or.jp/contact/
小林会計事務所,http://www.kktax.jp/,群馬県伊勢崎市今泉町1-2-5,https://www.kktax.jp/form/kktaxjp/inquiry
桂川会計（桂川淳税理士事務所）,http://katsuragawa-kaikei.com/,群馬県高崎市和田多中町3-12,https://katsuragawa-kaikei.com/contact/
小田島税務会計事務所,http://www.odashimakaikei.com/,茨城県土浦市右籾510-2,https://www.odashimakaikei.com/form/odashimakaikeicom/contact
税理士法人Arzt,http://www.itoffice.co.jp/,東京都新宿区高田馬場2丁目14番地2号　新陽ビル401,https://anshin-souzoku.biz/
共立パートナーズ株式会社,http://www.kyoritsu.ac/,東京都文京区白山1-30-14,https://www.kyoritsu.ac/contactus
税理士法人　尾藤会計事務所,http://www.bitohkaikei.com/,東京都新宿区西新宿7-18-10　島田ビル3階,https://www.bitohkaikei.com/free9
木下裕隆税理士事務所,http://www.kinoshitakaikei.com/,東京都江東区亀戸3-45-4　TACビルディング,https://www.kinoshitakaikei.com/80topix.html
ヘリテイジ税理士法人,https://www.heritage-taxaccountant.com/office,東京都中央区日本橋人形町１－１８－８第２篠原ビル６Ｆ,https://www.heritage-taxaccountant.com/form/heritage-taxaccountantcom/inquiry
つきおか税理士 月岡税理士事務所,http://www.tsu-zeirisi-kaikei.com/,東京都江東区大島８－３４－１１-４階　４１１号室,https://www.tsu-zeirisi-kaikei.com/form/tsu-zeirisi-kaikeicom/inquiry
アプト会計事務所,http://www.aptkaikei.com/,東京都北区赤羽2-21-8,https://www.aptkaikei.com/form/aptkaikeicom/page10
橋本税務会計事務所,http://www.hashimoto-noritax.com/,東京都中野区中野3-34-15 中村ビル３Ｆ,https://www.hashimoto-noritax.com/form/hashimoto-noritaxcom/inquiry
中村会計事務所,http://www.tax-n.jp/pc,東京都練馬区大泉学園町3-17-30,https://www.tax-n.jp/form/tax-njp/page10
田中桂司税理士事務所,http://www.tanaka-cpta.com,東京都渋谷区代々木1-36-1オダカビル4FC,https://www.tanaka-cpta.com/service/index.html#free
松山里果税理士事務所,http://www.office-matsuyama.com/,東京都品川区東大井,https://www.office-matsuyama.com/form/office-matsuyama/contact
Ｐ＆Ｐ税理士法人　瀬戸口グループ,http://www.setoao.com/,東京都大田区大森北1-11-5　共和7番館7F,https://www.setoao.com/form/setoaocom/inquiry
三井英一税理士事務所,http://www.321kaikei.jp/,東京都千代田区外神田6-16-3　外神田MNビル2F,https://www.321kaikei.jp/form/321kaikeijp/contact
鳥山会計事務所,http://www.toriyama-ao.com/,東京都目黒区下目黒2-18-3　目黒第一花谷ビル505,https://toriyama-ao.com/?page_id=13
吉川透税理士事務所,http://www.yoshikawa-kaikei.com/,東京都豊島区南池袋2-18-9　マ・シャンブル南池袋401,https://www.yoshikawa-kaikei.com/form/yoshikawa-kaikeicom/inquiry
居山税理士事務所,http://www.iyama-tax.jp/,東京都千代田区神田神保町2丁目14番地朝日神保町プラザ1104号室,https://www.iyama-tax.jp/form/iyama-taxjp/inquiry
いもづき税理士事務所,http://www.imoduki.jp/pc/free1.html,東京都品川区西五反田1-11-1　AiOS五反田駅前ビル7階,https://www.imoduki.jp/form/imodukijp/contact
星野会計事務所,http://www.hoshino-kaikei.com/,東京都豊島区池袋2-41-5アーバン154ビル　2F,https://www.hoshino-kaikei.com/form/hoshino-kaikeicom/inquiry
味岡滋税理士事務所,http://www.ajiokakaikei.com/,東京都武蔵野市吉祥寺東町1-4-23FOCO 101,https://www.ajiokakaikei.com/form/ajiokakaikeicom/inquiry
税理士法人　河合会計,http://www.kawaijimusho.com/,東京都武蔵村山市学園4-41-18,https://www.kawaijimusho.com/form/kawaijimushocom/inquiry
下地税務会計事務所,http://www.shimoji-kaikei.jp/,東京都国分寺市日吉町3-13-6,https://www.shimoji-kaikei.jp/form/shimoji-kaikeijp/inquiry
税理士法人オンリー・ワン,http://www.tax-8.com/,東京都八王子市中野上町4-23-4,https://www.tax-8.com/form/tax-8com/inquiry
おざわ会計,http://www.ozawakaikei.com/,東京都八王子市散田町3-19-19 2F,https://www.ozawakaikei.com/form/ozawakaikeicom/contact
税理士法人 大嶋会計,http://www.osmk-ohb.co.jp/,千葉県千葉市中央区新宿２－１０－３,https://www.osmk-ohb.co.jp/contact/
税理士法人いさやま会計,http://www.isasystems.co.jp/,神奈川県川崎市麻生区万福寺1-1-1新百合ヶ丘シティビルディング6階,https://www.isasystems.co.jp/%e3%81%8a%e5%95%8f%e5%90%88%e3%81%9b/
税理士法人 三保新横浜会計事務所,http://www.miho-kaikei.com/,神奈川県横浜市港北区新横浜 2-3-24自社ビル3F～9F,https://www.miho-kaikei.com/form/miho-kaikei/contact
駒田誠税理士事務所,http://www.komada-kaikei.jp/,神奈川県横浜市青葉区青葉台1-5-7 司ビル 507号,https://www.komada-kaikei.jp/form/komada-kaikeijp/inquiry
門脇税務会計事務所,http://www.kadowaki-kaikei.com,神奈川県海老名市門沢橋2丁目4番33号,http://www.kadowaki-kaikei.com/busuiness-consul
税理士法人トリニティー 美保哲夫事務所,http://www.miho-kaikei.jp/,千葉県八千代市八千代台東1丁目28番12号,https://www.miho-kaikei.jp/form/miho-kaikeijp/inquiry
大野宣子税理士事務所,http://www.ohno-tax.net/,埼玉県上尾市井戸木2-7-13,https://www.ohno-tax.net/form/ohno-taxnet/inquiry
シトラス税理士法人,http://www.citrus-cta.com/,埼玉県川越市東田町 8-6,https://citrus-cta.com/script/mailform/contact/
土屋貴史税理士事務所,http://www.tsuchiyatax.com/,埼玉県川越市脇田本町Room to Bloom　102号室,https://www.tsuchiyatax.com/form/tsuchiyataxcom/inquiry
児玉学税理士事務所,http://www.kodamatax.com/pc,愛知県名古屋市中区新栄2-42-16,https://www.kodamatax.com/form/kodamataxcom/contact
山田英寿税理士事務所,http://www.yama-z.com/,静岡県静岡市清水区大坪2丁目10-15,https://www.yama-z.com/form/yama-zcom/inquiry
税理士法人 SAKAI会計,http://www.kaikei-ski.com/,愛知県日進市赤池町村東75-1,https://www.kaikei-ski.com/form/kaikei-skicom/inquiry
小野内会計事務所,https://www.onouchi-kaikei.com/,愛知県安城市池浦町池東２０番地４,https://www.onouchi-kaikei.com/form/onouchi-kaikeicom/contact
税理士法人 中村会計,http://www.nakamura-kaikei.net/,愛知県犬山市西北野142-1,https://www.nakamura-kaikei.net/form/nakamura-kaikeinet/contact
しのだ会計事務所,http://www.shinoda-ac.com/,岐阜県岐阜市入舟町3丁目32の3 篠田建設ビル3階,https://www.shinoda-ac.com/contact/index.php
安藤・内田会計事務所,http://www.autax.net/,三重県津市久居野村町606-43,https://www.autax.net/form/autaxnet/inquiry
税理士法人辻総合会計,https://m-assets.com/,大阪府大阪市中央区平野町3丁目3番7号ニューライフ平野町101、102、206号,https://m-assets.com/contact/
税理士法人エール会計,http://www.taxkent-nishitenma.com/,大阪府大阪市北区西天満1-11-20イトーピア西天満2302,https://www.taxkent-nishitenma.com/form/taxkent-nishitenmacom/inquiry
田川会計事務所,http://www.tagawakaikei.com/,兵庫県尼崎市東園田町4-101-7ナイト－ビル303号,https://www.tagawakaikei.com/free1
税理士法人ヨシオカ事務所,http://www.ysz.jp/,大阪府豊中市岡上の町４丁目３番２号　吉岡ビル４階,https://www.ysz.jp/free2
周参見税理士法人,http://www.susami.com/,大阪府大阪市中央区谷町3-2-11　フラッグス9F,https://www.susami.com/?page_id=59
税理士法人 阪神税務総合事務所,http://www.e-zeirishi.jp/,兵庫県川西市中央町8番8号アメニティ川西ﾋﾞﾙ5階,https://e-zeirishi.jp/online/
遠藤税理士事務所,http://www.endou-tax.jp/,大阪府寝屋川市松屋町20-33グランドリヴィエール3階,https://www.endou-tax.jp/application_form/
元木啓雄税理士事務所,http://www.motoki-tax.com/,京都府京都市下京区七条通間之町東入材木町483　第二マスイビル4階,https://www.motoki-tax.com/form/motoki-taxcom/inquiry
松田進税理士事務所,http://www.kyoto-matsudatax.com/,京都府京都市下京区柳馬場通松原下ル忠庵町309シャトー庵　2階B号室,https://www.kyoto-matsudatax.com/form/kyoto-matsudataxcom/inquiry
汐瀬税理士事務所,http://www.shiose-tax.com/,京都府京都市伏見区桃山羽柴長吉東町83-6　朝日興産ビル3階,https://www.shiose-tax.com/form/shiose-taxcom/inquiry
