会社名,URL,住所,お問合せURL
税理士法人牛窪会計,http://www.ushikubo-office.com/,埼玉県狭山市水野529-1,https://www.ushikubo-office.com/personal
市川昭税理士事務所,http://www.ichikawa-zeirishi.com/,埼玉県飯能市稲荷町１０－１４総合相談センター名栗園３階,https://www.ichikawa-zeirishi.com/form/ichikawa-zeirishicom/inquiry
税理士法人グローリア 高橋会計事務所,http://www.h-takahashi.jp/,千葉県千葉市緑区あすみが丘1-27-2 藤屋第2ビル3階,https://www.h-takahashi.jp/form/h-takahashijp/inquiry
大久保守人税理士事務所,http://www.okubo-zeimukaikei.com/,神奈川県川崎市高津区子母口852－12第3小野ビル101号,https://www.okubo-zeimukaikei.com/form/okubo-zeimukaikeicom/inquiry
下山税理士事務所,http://www.shimoyama-office.jp/,神奈川県横浜市中区長者町5-85 三共横浜ビル7階,https://www.shimoyama-office.jp/contact/
株式会社健全経営サポートセンター　Y-TAC古川会計事務所,http://www.kenzenkeiei.com/,神奈川県横浜市西区南幸２丁目１９－４南幸折目ビル ４階,https://www.kenzenkeiei.com/page07
市川章税理士事務所,http://www.ichikawakaikei-tax.com/,神奈川県横浜市保土ヶ谷区西谷町９０３－５,https://www.ichikawakaikei-tax.com/form/ichikawakaikei-taxcom/inquiry
税理士法人あすか,http://www.asukanet.biz/,神奈川県横浜市鶴見区鶴見中央3-3-34　鈴幸ビル203号,https://www.asukanet.biz/about/service-line/Inheritance.html
林会計事務所,http://hayashi-kaikei.biz,神奈川県横浜市中区常盤町2-17常盤町新井ビル3F,https://hayashi-ao.tkcnf.com/form/hayashi-ao/inquiry
鍵谷正視税理士事務所,http://www.yokohama-kagirintax.biz/,神奈川県横浜市栄区鍛冶ヶ谷町452-120,https://www.yokohama-kagirintax.biz/form/yokohama-kagirintaxbiz/inquiry
税理士法人オフィスオハナ,http://office-ohana.jp/,神奈川県横浜市神奈川区栄町5-1　横浜クリエーションスクエア15階,https://www.office-ohana.jp/seminor
有限会社加賀計算センター,https://www.kaga-kei.jp/,千葉県柏市加賀1-18-6,https://www.kaga-kei.jp/jisyakeiri-top/bunseki-soudan.html
税理士法人桜頼パートナーズ会計　氏原事務所,http://www.ujiharakaikei.com/,千葉県浦安市当代島1-11-12,https://www.ujiharakaikei.com/form/ujiharakaikeicom/inquiry
柿澤祐子税理士事務所,http://www.kaki-kaikei.com/,東京都千代田区神田神保町2-4水戸興産ビル4F,https://www.kaki-kaikei.com/form/kaki-kaikeicom/inquiry
高城会計事務所,http://www.takagi-tax.com/,東京都新宿区三栄町8番地2　KRA四谷ビル2階,https://www.takagi-tax.com/form/takagi-taxcom/inquiry
佐藤元芳税理士事務所,http://www.myoshi-tax.jp/,東京都新宿区西新宿3-3-23ファミ－ル西新宿308,https://www.myoshi-tax.jp/form/myoshi-taxjp/inquiry
平田会計事務所,http://www.hiratakaikei.jp/,東京都文京区湯島３－２８－２永谷マンション３０２,https://www.hiratakaikei.jp/form/hiratakaikeijp/inquiry
総合会計事務所マネジメント・サポート,http://www.m-support.ne.jp/,東京都豊島区西池袋5-4-7　池袋トーセイビル8F,https://www.m-support.ne.jp/contact/
中央税理士法人,http://www.chuo-tax.or.jp/,東京都千代田区神田多町2-11-2カツミビル3F,https://www.chuo-tax.or.jp/contact/
株式会社テムスコンサルタンツ,http://www.ztms.jp/,東京都豊島区南池袋 2丁目17番11号　後藤ビル3F,https://www.ztms.jp/form/ztms/20171212133800
税理士法人TACSイレブン,http://narita-tax.com/,東京都千代田区二番町8－7二番町パークフォレスト1204号室,https://narita-tax.com/contact/index.htm
鈴木康公税理士事務所,http://www.tax-suzuki.net/,東京都豊島区駒込1-43-14　SK90ビル501号,https://www.tax-suzuki.net/contact_us.html
K＆S綜合会計,http://www.7239700.com/pc/office.html,東京都町田市原町田6-27-19 平本ビル3階,https://www.7239700.com/form/7239700/contact
榊原税理士事務所,https://z-sakakibara.tkcnf.com,愛知県豊田市東梅坪町10-4-16　ユニーブル梅坪107,https://z-sakakibara.tkcnf.com/form/z-sakakibara/contact
税理士法人藤本会計事務所,http://www.fujimoto-kaikei.jp/,大阪府大阪市中央区本町2丁目3番14号 船場旭ビル802号,https://fujimoto-kaikei.jp/contact/
中岸税理士事務所,http://www.nakagishi.com/,兵庫県神戸市中央区浜辺通3丁目1番31号クローバーハイツ三宮102,https://www.nakagishi.com/contact.html
田村一美公認会計士事務所,http://www.tamura-cpa.jp/,兵庫県姫路市東今宿3丁目2番36号,https://www.tamura-cpa.jp/service/#nagare
細見会計事務所,http://www.hosomi-office.com/,兵庫県西宮市甲子園口2-9-2,https://www.hosomi-office.com/contact
田中恵公認会計士事務所,http://www.mt-cpa.jp/,福岡県福岡市中央区渡辺通2-1-82 電気ビル北館9階,https://www.mt-cpa.jp/contact.html
井口千秋税理士事務所/井口行政書士事務所,https://www.ymc.bz/,沖縄県那覇市首里汀良町 1丁目37,https://www.ymc.bz/contact
税理士法人HOP,http://www.zeirishihoujin-hop.com/,東京都中央区日本橋人形町2-13-9FORECAST人形町7階,https://www.zeirishihoujin-hop.com/contact
大内税理士事務所,http://www.ouchi-tax.com/,兵庫県神戸市中央区北長狭通5-2-19-301,http://www.ouchi-tax.com/contact
宮崎税務会計事務所,http://www.miyazaki-zeimu.com/service/service02_josei.php,熊本県熊本市中央区新大江1-15-4,https://www.miyazaki-zeimu.com/service/service02.php
下川・木地税理士法人,https://shimokawa-kiji-and-co.jp/,東京都中央区明石町1-29 掖済会ビル2F,https://shimokawa-kiji-and-co.jp/contact/
税理士事務所センチュリーパートナーズ,http://www.century-partners.jp/,東京都渋谷区恵比寿南2-21-2恵比寿サウスヒル301,https://www.century-partners.jp/category/1776553.html
税理士法人協栄会計,https://kyouei.tkcnf.com/,北海道札幌市西区二十四軒４条5-2-18,https://kyouei.tkcnf.com/form/kyouei/inquiry
嶋矢UFT税理士綜合事務所,http://zei-komon.com/,神奈川県川崎市幸区幸町3-547-1,https://zei-komon.com/?page_id=11
株式会社相続専門オフィス,http://souzoku-zouyo.com/,大阪府大阪市北区芝田1-4-8 北阪急ビル9F,https://souzoku-zouyo.com/contact.html
税理士法人熊谷事務所,http://kumagai-jimusho.com/,東京都千代田区神田神保町2-14　SP神保町ビル10階,https://kumagai-jimusho.com/contact/
大柴税理士事務所,https://www.os-zeirishi.com/,千葉県柏市柏3-10-29-601,https://www.os-zeirishi.com/%e3%81%8a%e5%95%8f%e3%81%84%e5%90%88%e3%82%8f%e3%81%9b/
宮﨑税理士・行政書士事務所,http://miyazaki-tax.com/,大阪府大阪市中央区谷町1丁目3-19 マルマスビル4F,https://miyazaki-tax.com/contact.html
株式会社ファイブスター,http://www.fstars.co.jp/,愛知県名古屋市中区丸の内1丁目4番12号　アレックスビル3F,https://www.fstars.co.jp/contact/
税理士法人エタニティ,http://eternity-tax.com/,東京都港区港南2-4-11エステムプラザ品川駅前5th Avenue1103号,https://www.eternity-tax.com/inquiry/
ポラリス税理士法人,http://polariskaikei.com/,東京都渋谷区代々木2-14-5 新宿F2ビル5階,https://polariskaikei.com/contact
税理士法人常陽経営,http://www.tsu-hankeiri.com/,福島県いわき市内郷高坂町砂子田94番地,https://www.tsu-hankeiri.com/contact.html
竹下博貴税理士事務所,http://taketax.jp/,熊本県熊本市中央区神水2-13-34竹下ビル4F県庁通り,https://taketax.jp/contact/
税理士法人久保田会計事務所,http://www.kubotax.com,京都府京都市中京区丸太町通東洞院東入関東屋町671,https://www.kubotax.com/inquiry/
税理士法人 和敬会つくば事務所（荒木会計事務所）,http://www.tmbp.co.jp,茨城県つくば市研究学園6丁目42番地3,https://tmbp.co.jp/inherit
税理士法人ゼニックス・コンサルティング,http://www.xenix.com,東京都港区芝公園1-3-12 クローバー芝公園2F,https://xenix.com/contact/
税理士法人東京シティ税理士事務所,http://www.tokyocity.co.jp/,東京都新宿区西新宿2-1-1 新宿三井ビル33階,https://tokyocity.co.jp/contact/sougou/
マネーコンシェルジュ税理士法人,http://www.money-c.com/,大阪府大阪市北区南森町2-1-29　三井住友銀行南森町ビル3F,https://www.money-c.com/try/index.html#sec02
税理士法人HYK,https://www.kaikei-home.com/hyk/,大阪府大阪市住之江区御崎３丁目５－１,javascript:void(0);
OAG税理士法人,https://www.oag-tax.co.jp/,東京都千代田区五番町6-2 ホーマットホライゾンビル,https://www.oag-tax.co.jp/contact/
Nagano Moritaグル-プ,http://www.nagano-morita.com/,東京都港区新橋 2-20-15新橋駅前ビル1号館504号,https://www.nagano-morita.com/contact
匠税理士事務所,http://www.takumi-tax.jp/,東京都目黒区自由が丘1-4-10quaranta1966-404,https://www.takumi-tax.jp/mailform.html
谷口敏文税理士事務所,http://www.tt-tax.net/,東京都千代田区神田三崎町3丁目5番9号,https://www.tt-tax.net/contact
NBC税理士法人グループ,https://www.nbc-tax.jp/,東京都新宿区市谷田町3丁目24 NBCネクスト市谷ビル3階,https://nbc-tax.jp/contact
湯沢会計事務所,http://www.yuzawa.com/com_02.html,東京都中央区日本橋横山町1-3 OKK日本橋ビル2F,https://www.yuzawa.com/form1/index.html
橋本浩幸税理士事務所,http://www.hashimoto2005.com/,愛知県名古屋市中区新栄町2-9 スカイオアシス栄1F,https://hashimoto2005.com/flow/
税理士法人蔵人会計事務所,http://www.c-road.jp/,東京都中央区日本橋2-3-6 日土地日本橋ビル5Ｆ,https://www.c-road.jp/reference_form.html
有限会社KYコンサルティング,http://kyc2005.com/,千葉県松戸市松戸1794-3,https://kyc2005.com/kaisya-seturittu-soudan.htm
池田会計事務所,http://www.mmcea.com/,東京都江戸川区松江２－４０－１２－１０５,https://mmcea.com/an-inquiry-form/
長嶋佳明税理士事務所,http://www.souzoku-fp.com/,兵庫県芦屋市大桝町7番6号 芦屋大桝町アネックス301,https://www.souzoku-fp.com/html/contact.html
株式会社信光經営センター,http://www.shinko-gr.com/,長野県長野市鶴賀2141-3信光ビル,https://shinko-gr.com/contact
むさしの税理士法人,https://mtax.or.jp,東京都武蔵野市中町1-19-2 矢島ビル3階,https://mtax.or.jp/contact
名波会計事務所,http://www.nanami-kaikei.jp/,静岡県掛川市塩町7-3,https://www.nanami-kaikei.jp/management-consultation
日新税理士事務所,http://www.ns-1.biz/,大阪府大阪市中央区大手前1-7-31 OMMビル13F,https://ns-1.biz/otoiawase.htm
ななせ総合事務所,http://www.nanase.biz/,大分県大分市荷揚町6番16号　スカイメゾン外苑207号,https://www.nanase.biz/contact/
石原会計事務所,http://www.ishihara-k.net/,愛知県名古屋市中川区露橋 1-13-12,https://ishihara-k.net/cont
むらずみ経営グループ,http://www.murazumi.jp/,北海道札幌市中央区北1条西13丁目4番地 FWD札幌ビル10階,https://secure02.blue.shared-server.net/www.murazumi.jp/contact/contact.html
岩井優税理士事務所,http://www.zeikaikei.com,神奈川県横浜市中区不老町1-6-9　第一HBビル3F,https://www.zeikaikei.com/contact.html
税理士法人TM総合会計事務所,http://www.tm-taxcpa.jp/,東京都文京区音羽1-17-18 護国寺SIAビル8階,https://www.tm-taxcpa.jp/category/1215964.html
株式会社プロネット,http://www.pronetjp.com/index.html,福岡県福岡市博多区東比恵2丁目7番14号,https://www.pronetjp.com/inquiry/
公認会計士・税理士昆司事務所,http://www.k-ac.co.jp/,岩手県盛岡市東安庭一丁目２番１８号,https://www.k-ac.co.jp/contact.html
税理士法人九段会計事務所,https://www.kudan-tax.jp/,東京都千代田区九段南4-3-1滝ビル3F,https://www.kudan-tax.jp/contact
有限会社みらい経営支援センター,http://e-egao.biz/,大分県日田市上手町1-1,https://e-egao.biz/contact/gosodan/
柴田税務会計事務所,http://shibataoffice.com/,東京都渋谷区道玄坂2丁目10-7 新大宗ビル1325号,https://shibataoffice.com/contact.html#header
株式会社合同会計,http://www.godoh.co.jp/,埼玉県川口市青木 ２－２－７,https://www.godoh.co.jp/contact/
税理士法人 創経,http://www.sohkei.com/company.html,愛知県名古屋市西区牛島町6番1号名古屋ルーセントタワー36階,https://www.sohkei.com/contact
庵章税理士事務所,http://www.iori-kaikei.com/,兵庫県神戸市中央区磯辺通3-2-17 ワールド三宮ビル8階,https://www.iori-kaikei.com/inq/
廣瀬税理士事務所,http://www.souzoku-help.biz/,福岡県糸島市前原西1-8-27 第2広瀬ビル3F,https://www.souzoku-help.biz/contact/
株式会社エフピーインテリジェンス,http://www.fpintel.net/,東京都港区赤坂5-1-26Sunrise Akasaka Bldg. 4F,https://www.fpintel.net/contact
日本橋税理士法人H＆Sパートナーズ,http://www.hamahira.com/,東京都中央区日本橋堀留町1丁目2番16号 瀧田ビル5階,https://www.hamahira.com/inquiry.htm
秋山税理士事務所,https://akiyama-akp.or.jp/,東京都世田谷区等々力4-5-13,https://akiyama-akp.or.jp/shisan/index.html
安田会計事務所,http://www.yasudakaikei.com/,東京都大田区中央1-19-2 高田ビル203,https://www.yasudakaikei.com/inquiry/
中村通孝税理士・不動産鑑定事務所,http://mntax-app.life.coocan.jp/,東京都品川区旗の台2-7-17,https://mntax-app.life.coocan.jp/question.htm
笠置税理士事務所,http://www.kasagi-tax.com/,東京都江戸川区西葛西5-11-11司ビル４階,https://kasagi-tax.com/contact/
税理士法人大和,http://www.sokei.co.jp/,東京都渋谷区渋谷２丁目１番６号青山ｴｲﾃｨ-ﾝﾋﾞﾙ,https://www.sokei.co.jp/ask/
伊藤税務会計事務所,http://www.itoutax.com/,東京都練馬区氷川台4-41-5,https://www.itoutax.com/kakutei/index.html
税理士法人日野総研,http://www.e-k-ei.com/,東京都日野市日野本町3丁目8-3,https://www.e-k-ei.com/form/e-k-eicom/inquiry
ゆば税務会計事務所,https://www.yuba-kaikei.com/,神奈川県川崎市川崎区宮本町6-2-1402,https://www.yuba-kaikei.com/category/1426704.html
甲田税理士事務所,http://kotax.jp/,神奈川県横浜市西区浜松町 11-32-5F,https://www.kotax.jp/service/flow/
奥山会計事務所,http://okuyamakaikei.com/,神奈川県横須賀市根岸町3-7-9プランナーズビル3F,https://okuyamakaikei.com/contact/
税理士法人山田会計,https://www.yamada-kaikei.jp/,埼玉県さいたま市大宮区高鼻町2-62-2,https://www.yamada-kaikei.jp/contact.html
税理士法人アズール,http://www.azuretax.jp/,愛知県名古屋市東区東桜一丁目8番16号 ロータス東桜ビル,https://www.azuretax.jp/inheritance
丸野税理士事務所,http://maruno.com/,静岡県浜松市中区住吉2-14-24,https://maruno.com/contact/
冨岡寿浩税理士事務所,http://www.office-tomioka.net/,静岡県島田市中河町1943-30,https://www.office-tomioka.net/ask/ask.html
みどり経営グループ　ミッドランド税理士法人,http://www.midori-keiei.com/,愛知県刈谷市幸町2-3-3,https://midori-keiei.com/contactus
増田会計事務所,http://www.masuda-kaikei.jp/,大阪府大阪市天王寺区生玉町11－29朝日プラザ高津第一306号,https://www.masuda-kaikei.jp/contactus/
中野弘一税理士事務所,http://www.z-nakano.com/,大阪府大阪市北区東天満2-6-8　篠原東天満ビル803,https://z-nakano.com/otoiawasepage/
ハマダ会計事務所,http://www.hamadakaikei.com/,大阪府大阪市福島区玉川2-8-4大阪福島サウスビル703号室,https://hamadakaikei.com/ask/index.html
和田敦税理士事務所,http://www.wadatsu-tax.com/,兵庫県伊丹市中野北3丁目4-21 中野ビル3F,https://www.wadatsu-tax.com/service/entrepreneur.html
税理士法人 三好会計,http://www.miyoshikaikei.com/,福井県越前市日野美2丁目9番地,https://www.miyoshikaikei.com/form/miyoshikaikeicom/contact
株式会社アベ経営・安部春之税理士事務所,http://www.abe-keiei.co.jp/,兵庫県神戸市中央区東川崎町1-7-4 ダイヤニッセイビル14F,https://www.abe-keiei.co.jp/contact
田口智弘税理士事務所,http://www.taguchi-tax.info/,兵庫県神戸市中央区京町76番地2　明海三宮第2ビル4階,https://www.taguchi-tax.info/contact
蘆田総合会計事務所,http://www.asida7.com/,兵庫県西脇市上野104-1,https://www.asida7.com/form_001.html
藤原覚税理士事務所,http://www.office-fujiwara.com/,兵庫県西宮市小松西町2丁目3番1号,https://www.office-fujiwara.com/contact.html
株式会社オフィスミツヒロ／光廣税務会計事務所,http://www.office-m.co.jp/,広島県広島市中区寺町5番20号 広島城南リバーサイドB.L.D 2階,https://www.office-m.co.jp/contact/
今井会計事務所,http://www.imaikaikei.com/,福島県福島市八木田字榎内19-3,https://imaikaikei.com/toiawase/
札幌あおい　税理士法人,http://tax-aoi.jp/,北海道札幌市中央区大通東2丁目8-5　プレジデント札幌ビル4階,https://tax-aoi.jp/contact.php
税理士法人 越智総合会計,http://www.ochi-tax.com/,兵庫県宝塚市山本丸橋2-15-3-202,https://www.ochi-tax.com/form_1
アームズグループ,http://www.arms-gr.com/,北海道虻田郡俱知安町比羅夫5番5,https://www.arms-gr.com/form/arms-grcom/page10
山口会計,http://www.y-kikaku.jp/,群馬県前橋市日吉町2-5-1みずき館103,https://www.y-kikaku.jp/form/y-kikakujp/contact
有限会社山上会計事務所,https://kiryu-yamakami.co.jp/,群馬県桐生市元宿町9番26号,https://kiryu-yamakami.co.jp/contact/
月岡公認会計士事務所,http://tsukioka-cpa.com/,東京都千代田区九段北1-9-5朝日九段マンション1101,https://tsukioka-cpa.com/contact/
今井博子税理士事務所,http://www.imai-tax.jp/,東京都港区芝5-5-6　インフィニティ三田101,https://imai-tax.jp/contact/
株式会社田中コンピューター会計,http://www.tanakakaikei21.jp/,東京都足立区栗原3-23-6オリエント第3ビル2Ｆ,https://www.tanakakaikei21.jp/info#ttl-news2021
SHIGE税理士法人,http://www.shige-zeirishi.com/,東京都千代田区九段北3-2-11住友不動産九段北ビル8階,https://www.shige-zeirishi.com/soudankai_list/
恩田泰臣税理士事務所,https://www.kaikei-home.com/ondacpta/,東京都江戸川区東葛西6-8-7-202,javascript:void(0);
奥山税理士事務所,http://www.okuyama-kaikei.com/,東京都豊島区南池袋2丁目10番3号榮ビル6階,https://okuyama-kaikei.com/contact/
株式会社第一会計コンサルタント,http://www.dkc-g.co.jp/,東京都豊島区池袋2-46-3　CIMA100ビル5階～7階,https://www.dkc-g.co.jp/service1.html
関口義宏税理士事務所,https://sekiguchi-tax.com/,東京都町田市南成瀬1-7-9　中里ビル,https://sekiguchi-tax.com/contact/
森豊税理士事務所,http://www.mori-j.com/,神奈川県相模原市中央区淵野辺本町4-12-3 リバティーハイツ淵野辺203号,https://www.mori-j.com/contact.html
峯岸会計事務所,http://www.minegisikaikei.com/,埼玉県所沢市北秋津355番地7,https://minegisikaikei.com/contact/
山本会計事務所,http://www.yamamotokaikei.com/,千葉県千葉市中央区新宿２－１０－３,https://www.yamamotokaikei.com/FormMail/yamamotokaikeipostmail/FormMail.html
西山税理士事務所,http://www.nishiyamakaikei.jp/,神奈川県川崎市中原区上丸子山王町1丁目873番地6 2F,https://nishiyamakaikei.jp/seminar_guide/seminar_info/202404_seminar.html
有限会社横浜総合コンサルティング,https://yokohamaconsul.com/,神奈川県横浜市中区弥生町2丁目17番ストークタワー大通り公園1-802号,http://yokohamaconsul.com/contact/
辻村法子税理士事務所,https://www.tsujimura-tax.net/index,台町15-12　クレベールヨコハマ106,https://www.tsujimura-tax.net/form/tsujimura-taxnet/inquiry
大内浩一税理士事務所,https://www.ouchi-tax.jp/,神奈川県横浜市南区井土ヶ谷下町41－10 AKビル301,https://ouchi-tax.jp/flow/
長堀税務会計事務所,http://www.nagahori-zeirishi.jp/,神奈川県横浜市青葉区あざみ野1-24-3　正和ビル２階,https://www.nagahori-zeirishi.jp/form/nagahori-zeirishijp/contact
税理士法人アイ・ブレインズ 町田事務所,http://machida.i-brains.or.jp/,東京都町田市玉川学園1-23-3,https://www.i-brains.or.jp/contact/
横須賀税理士法人,http://www.youkoso-yokoso.com/,神奈川県横須賀市小川町25番地3 税理士合同ビル2階,https://www.youkoso-yokoso.com/form/youkoso-yokoso/page10
水野税務会計事務所,http://www.mizuno-z.jp/,埼玉県川越市東田町15-10,https://www.mizuno-z.jp/category/1484245.html
服部主計税理士事務所,http://www.hattorikaikei.com/office.html,愛知県名古屋市守山区町南28-17,https://www.hugedomains.com/contact.cfm
あいち税理士法人,http://www.agkg.jp/,愛知県名古屋市瑞穂区師長町83-1　ライオンズマンション山下通1F,https://agkg.jp/info/
前田事務所,http://www.maeda-kaikei.com/,愛知県名古屋市北区金城二丁目7-10,https://ai-front.com/contact
税理士法人 内山会計 神藤事務所,http://j-kaikei.info/,愛知県豊橋市向山台町10-２５　神藤ビル1F,https://www.j-kaikei.info/?page_id=21
伊藤徳善税理士事務所,http://www.nori-tax.com/,三重県鈴鹿市野町西三丁目11-1,https://www.nori-tax.com/form/nori-taxcom/inquiry
トータルサポート税理士事務所,http://www.ts-tax.jp/,大阪府大阪市北区中之島４丁目２－２８甲南アセット中之島ビル６０１号,https://www.ts-tax.jp/form/total/page4
かなえ経営株式会社,https://kanae-keiei.com/,大阪府大阪市北区東天満1-10-12エル・エスト不動産天満ビル802,https://kanae-keiei.co.jp/contact
高島会計事務所,http://www.takasimakaikei.com/,大阪府大阪市中央区今橋１丁目７番１４号堺筋北浜宗田ビル５階,https://www.takasimakaikei.com/kaijyousien.html
加藤久幸税理士事務所,http://www.katozeimu.com/access.html,大阪府大阪市北区天神橋3丁目11番3号,https://www.katozeimu.com/contact/contact.php
太田税理士事務所,http://www.ota-tax.com/,大阪府大阪市北区浪花町14-33（OMビル507号）,https://www.ota-tax.com/
下河内会計事務所,http://www.shimo-tax.jp/,大阪府大阪市東成区大今里西1丁目29番14号 富士火災今里ビル5階,https://www.shimo-tax.jp/inquiry/
税理士法人野口会計事務所,http://www.e-naranet.com/,奈良県奈良市高天町21-2　野口高天ビル,https://www.e-naranet.com/contact.html
税理士法人ブレインズ,http://www.brains-group.co.jp/,京都府宇治市小倉町神楽田21-5　アーバネックス小倉ビル2F,https://www.brains-group.co.jp/contact/
岡田税務会計事務所,http://okada-tax-accounting-office.com/,兵庫県加古川市加古川町平野449-1　ステイＧ201号,https://okada-tax-accounting-office.com/contact/
菊池孝太郎税理士事務所,http://www.mirai-keiei.com/,広島県広島市東区牛田中1丁目1-11,https://www.mirai-keiei.com/contact/
鹿島税務会計事務所,http://kashima-kaikei.jp/,宮崎県都城市花繰町６－１３,https://kashima-kaikei.jp/contact.html
松木会計事務所,https://matuki-kaikei.tkcnf.com/,長野県諏訪市四賀赤沼１８２１,https://matuki-kaikei.tkcnf.com/form/matuki-kaikei/page6
税理士法人TM総合事務所,http://www.tm-tax.jp/,東京都新宿区四谷1-8-14 四谷一丁目ビル9F,https://www.tm-tax.jp/contact/
河合税務会計・総合計画事務所,http://www.kaai1.com/,東京都墨田区東向島５－２３－１８,https://www.kaai1.com/cpta/blog.cgi?n=92&category=09
福田税理士事務所,http://f-kaikei.com/,東京都墨田区向島3-34-12,https://www.f-kaikei.com/contact/index.html
税理士法人エクラコンサルティング,http://www.eclat-c.com/,東京都千代田区紀尾井町4-1 ニューオータニガーデンコート 8F,https://www.eclat-c.com/contact/
税理士法人ビランツ,http://www.bilanz.jp/,東京都江東区亀戸3-1-2-201藤和シテイコープ錦糸町,https://www.bilanz.jp/contact.html
木村まり子税理士事務所,http://www.kimura-tax.com/,東京都板橋区小豆沢2-5-1クレールあづさわ411号,https://kimura-tax.com/contact/
中野稔税理士事務所,http://zeirishi-nakano.com/,神奈川県相模原市南区松が枝町16−4　小山ビル1Ｆ,https://zeirishi-nakano.com/contact/
深山秀一税理士事務所,https://miyama-taxoffice.jp/,千葉県船橋市前原西３-１７-１２,https://miyama-taxoffice.jp/%e3%81%8a%e5%95%8f%e3%81%84%e5%90%88%e3%82%8f%e3%81%9b/
株式会社平松経営センター,http://www.tsb-h.co.jp/,大阪府大阪市中央区南本町一丁目4番10号スト－クビル6階,https://www.tsb-h.co.jp/mail
アイファー税理士法人,https://www.kaikei-home.com/nagatazeirishi/,大阪府大阪市堺市堺区中之町東4丁3番13号フェニックスビル,javascript:void(0);
小串税務会計事務所,http://www.office-ogushi.jp/,大阪府枚方市東香里元町36番16号,https://www.office-ogushi.jp/form/office-ogushi/contact
佐久間一郎税理士事務所,http://www.sakumazeirisi.com/,香川県高松市寿町二丁目2番10号高松寿町プライムビル202,https://www.sakumazeirisi.com/consultation/
税理士法人　あしたば会計,http://www.asita-ba.jp/,香川県高松市今里町７－１６,https://www.asita-ba.jp/#contact
