会社名,URL,住所,お問合せURL
税理士法人シン総合会計,https://shin-account.com/,神奈川県横浜市西区浅間町3丁目167番地3,https://shin-account.com/contact
F&Mパートナーズ税理士法人,http://www.fmpt.jp/,東京都新宿区西新宿3-2-11　新宿三井ビルディング二号館3Ｆ,https://www.fmpt.jp/contact
上野智弘税理士事務所,https://uenotoshihiro.com/,京都府京都市左京区下鴨蓼倉町80番地の3,https://uenotoshihiro.com/%E3%81%8A%E5%95%8F%E3%81%84%E5%90%88%E3%82%8F%E3%81%9B/
Pision合同会社,https://pision.jp/,東京都品川区東五反田3-17-4 糟谷ビル3F,https://forms.gle/L4MeHYQausbSYhfTA
下村昇治税理士事務所,http://www.shimozei.com/,東京都中央区銀座8-11-5 正金ビル2F,https://shimozei.com/contents#a01
山崎義孝税理士事務所,https://www.e-yamasaki.com/,福岡県春日市春日原北町1丁目3番14号,https://www.e-yamasaki.com/form/
税理士事務所ウェルタックス,https://www.welltax.jp/,福岡県福岡市南区多賀１丁目２−３６−１０２,https://www.welltax.jp/%E6%A5%AD%E5%8B%99%E3%81%AE%E3%81%94%E6%A1%88%E5%86%85/%E5%80%8B%E5%88%A5%E7%9B%B8%E8%AB%87%E3%82%B5%E3%83%9D%E3%83%BC%E3%83%88/
税理士新谷税理士事務所,https://www.shinyakaikeipro.com/,神奈川県大和市大和南1-5-16みずきビル4階,https://www.shinyakaikeipro.com/item/index.html#item1
東京ユナイテッド綜合事務所,https://www.tokyo-united.jp/,東京都文京区後楽一丁目4番14号　後楽森ビル18階,https://www.tokyo-united.jp/voice/
岡田慎一税理士・社会保険労務士事務所,http://so-tax.com/,東京都渋谷区代々木2-5-5新宿農協会館3Ｆ,https://so-tax.com/contact.html
税理士法人ＪＭＴｚ,https://jmt.cloud/,東京都千代田区神田東松下町30TKビル,https://jmt.cloud/#contact
愛宕山総合会計事務所,https://atagoyama.net/about/,東京都港区虎ノ門1-15-11　第2名和ビル10階,https://atagoyama.net/contact/
幅会計事務所,http://office-haba.com/cpa/,岐阜県岐阜市上竹町21,https://office-haba.com/cpa/contact/
森川大史税理士事務所,https://zeimori.jp/,広島県広島市東区光町2丁目6-41セネスビル4階,https://zeimori.jp/souzokusoudan/
廣田隆幸税理士事務所,http://white-tax.com/,大阪府大阪市都島区都島中通3-4-15シャロームアトム602号,https://white-tax.com/reserve
公認会計士・税理士　梁瀬会計事務所,https://wisdom-cpa.com/,愛知県名古屋市東区泉1-10-23 パムスガーデンPP 2F,https://wisdom-cpa.com/contact/
藤沼会計事務所,https://a-agent.co.jp/fujinuma,東京都中央区日本橋2-1-17丹生ビル2F,https://a-agent.co.jp/fujinuma/contact/
松田哲也税理士事務所,https://www.matsuda-taoffice.com/,香川県高松市川島東町936番地9,https://www.matsuda-taoffice.com/contact/
株式会社スタートアップアカウンティング,https://startup-accounting.co.jp/,東京都港区南青山1-1-1 新青山ビル東館15階 （サン共同会計事務所内）,https://startup-accounting.co.jp/contact.html
KPMG税理士法人,https://home.kpmg/jp/ja/home/,東京都港区六本木1-6-1泉ガーデンタワー,https://kpmg.com/jp/ja/home/misc/contact-kpmg.html
やなぎ総合法務事務所,http://www.yanagi-law.net/,大阪府大阪市阿倍野区阿倍野筋3-10-1　あべのベルタ3009号,https://yanagi-law.net/menu/
税理士法人ＣＯＮＦＩＡＮＣＥ,https://morioka-confiance.com/,岡山県倉敷市真備町川辺１２３番地１メルベーユ１０２,https://www.tl-assist.com/user/reservation/390/menu?staff_id=649
西村誠税理士行政書士事務所,https://nishimura-zeirisi.tkcnf.com/,岡山県新見市新見2123番地,https://nishimura-zeirisi.tkcnf.com/form/nishimura-zeirisi/inquiry
都丸智子税理士事務所,https://tomaru.tkcnf.com/,埼玉県北葛飾郡杉戸町高野台東１-８-１　エステート二晃ビル１Ｆ－Ｂ,https://tomaru.tkcnf.com/form/tomaru/page6
園田悟税理士事務所,https://sonoda-tax.com/,熊本県宇土市旭町421-1,https://sonoda-tax.com/contact
中崎電算機会計事務所,https://www.tkcnf.com/nakazakidensanki-kaikei,熊本県熊本市南区富合町古閑889-4,https://cms.tkcnf.com/nakazakidensanki-kaikei/form/contact
税理士法人昴,https://www.subaru-tax.net/,熊本県熊本市中央区安政町8-16 村瀬海運ビル6階,https://www.subaru-tax.net/contact/
税理士法人碓井会計,https://www.tkcnf.com/usui-keiei,熊本県熊本市中央区国府4-3-15,https://cms.tkcnf.com/usui-keiei/form/inquiry
奥田一哉税理士事務所,https://www.tkcnf.com/okuda,熊本県熊本市東区尾ノ上1-12-3-203,https://cms.tkcnf.com/okuda/form/inquiry
栁瀬税務会計事務所,https://yanasekaikei.tkcnf.com/,熊本県人吉市鬼木町694-3,https://yanasekaikei.tkcnf.com/form/yanasekaikei/inquiry
あさひ税理士法人,https://www.asahitax.co.jp/,熊本県宇土市南段原町67番地3,https://www.asahitax.co.jp/form/inomotozimusyo/inquiry
鈴木伸一税理士事務所,https://www.tkcnf.com/islander,熊本県熊本市西区島崎２丁目２４-１６,https://cms.tkcnf.com/islander/form/inquiry
税理士法人佐藤税務会計事務所,https://www.tkcnf.com/satoh-kouzou-kaikei,熊本県熊本市西区島崎3丁目1９番42号,https://www.tkcnf.com/satoh-kouzou-kaikei/inheritance
永村税理士・行政書士事務所,https://www.nagamura-tax.com/,熊本県熊本市中央区坪井6丁目21番19号,https://www.nagamura-tax.com/form/nagamura-tax/contact
隈元順一税理士事務所,http://www.kumamoto-zeimu.com/,熊本県合志市幾久富1866番地1582,https://www.kumamoto-zeimu.com/form/kumamoto-zeimu/contact
原誠也税理士事務所,http://cpta-hara.com/,熊本県熊本市東区保田窪3丁目14番22−2号,https://cpta-hara.com/contact/
税理士法人ＬＥＧＡＲＥ岡山オフィス（本店）,https://shimizu-taxoffice.tkcnf.com/,岡山県岡山市北区清心町　１６番３８号,https://shimizu-taxoffice.tkcnf.com/form/shimizu-taxoffice/page10
井上省吾税理士事務所,https://www.tkcnf.com/inoue-kaikei,岡山県玉野市玉２－２０－７,https://cms.tkcnf.com/inoue-kaikei/form/inquiry
江見匡史税理士事務所,https://emizeirisi.tkcnf.com/,岡山県岡山市北区大和町2丁目7-10　クリーク　ビュー　2F,https://emizeirisi.tkcnf.com/form/emizeirisi/inquiry
古谷英人税理士事務所,https://furutani-tax.tkcnf.com/,岡山県倉敷市福江1200-8 中原ビル1F,https://furutani-tax.tkcnf.com/form/furutani-tax/inquiry
上野山剛税理士事務所,https://uenoyama-kaikei.tkcnf.com/,岡山県岡山市北区鹿田町１－１－３中島ビル３階,https://uenoyama-kaikei.tkcnf.com/form/uenoyama-kaikei/inquiry
藤田誠税理士事務所,https://fujitajimusho.tkcnf.com/,岡山県都窪郡早島町早島5197,https://fujitajimusho.tkcnf.com/form/fujitajimusho/inquiry
東川清隆税理士事務所,https://higashikawa.tkcnf.com/,岡山県玉野市宇野２－２０－１８,https://higashikawa.tkcnf.com/form/higashikawa/inquiry
須山淳税理士事務所,https://j-suyama.tkcnf.com/,岡山県倉敷市真備町川辺　1193番地4,https://j-suyama.tkcnf.com/tkc-management-qa
児島正典税理士事務所,https://www.tkcnf.com/kojimakaikei,岡山県岡山市北区富田町2-6-19,https://cms.tkcnf.com/kojimakaikei/form/inquiry
日笠肇税理士事務所,https://www.tkcnf.com/hikasakaikei,岡山県美作市明見807-1,https://cms.tkcnf.com/hikasakaikei/form/inquiry
大川佳郎税理士事務所,https://ookawakaikei.tkcnf.com/,岡山県玉野市宇野4丁目10番10号 玉野土建ビル4F,https://ookawakaikei.tkcnf.com/form/ookawakaikei/inquiry
田中庄二郎税理士事務所,https://tanaka-tax-office.tkcnf.com/,岡山県岡山市南区豊成２－６－２２　アンタレス豊成１０１号,https://tanaka-tax-office.tkcnf.com/form/tanaka-tax-office/inquiry
真方雪恵税理士事務所,https://magata.tkcnf.com/,岡山県倉敷市二日市6-1,https://magata.tkcnf.com/form/magata/inquiry
岡﨑順一税理士事務所,https://okazakikaikei.tkcnf.com/,岡山県岡山市東区西大寺中野２４－４,https://tax-onoda-kaikei.tkcnf.com/form/tax-onoda-kaikei/inquiry
岡公認会計士事務所,https://cpa-oka.tkcnf.com/,岡山県岡山市北区今6-19-14,https://cpa-oka.tkcnf.com/form/cpa-oka/page7
松本誠 税理士事務所,https://www.tkcnf.com/matsumoto-makoto,岡山県津山市中村740-4,https://www.tkcnf.com/matsumoto-makoto/tkc-management-qa
林悦弘税理士事務所,http://haya-zei.biz/,岡山県岡山市北区今1-1-1-605,https://haya-zei.biz/contact/
大澤和弘税理士事務所,https://osawa-tax.tkcnf.com/,岡山県岡山市北区上中野１丁目19-45-202,https://osawa-tax.tkcnf.com/form/osawa-tax/contact
西山誠税理士事務所,https://www.office-nishiyama.jp/,岡山県岡山市北区辰巳23-133,https://office-nishiyama.jp/?page_id=494
大田博也税理士事務所,https://ootahiroyakaikei.tkcnf.com/,岡山県岡山市北区鹿田町１丁目７番３号,https://ootahiroyakaikei.tkcnf.com/form/ootahiroyakaikei/inquiry
片山税理士事務所,https://www.tkcnf.com/j-katayamakaikei/index,岡山県岡山市中区中井四丁目１３番１１号,https://cms.tkcnf.com/j-katayamakaikei/form/inquiry
光岡会計事務所,https://mitsuoka-zeirishi.tkcnf.com/page1,岡山県岡山市北区平和町2-5,https://mitsuoka-zeirishi.tkcnf.com/form/mitsuoka-zeirishi/contact
税理士法人KJグループ,http://www.kubokaikei.com,大阪府大阪市城東区野江4丁目11番6号,https://www.kubokaikei.com/other-service/real-estate-tax/
朝倉令子税理士事務所,http://www.asakura-office.net/,長野県諏訪市渋崎1791-95,https://www.asakura-office.net/inheritance/index.html
相川和永税理士事務所,http://www.ai-tax.com/,千葉県船橋市西船4丁目19-5　アルテミラ西船橋１F,https://ai-tax.com/contact/
ひかり税理士法人,http://www.hikari-tax.com/profile.php,京都府京都市中京区東洞院通竹屋町下る　ひかりビル,https://www.hikari-tax.com/contact
税理士法人 地藤会計事務所,http://www.zeimusoudansitu.com/,石川県金沢市増泉2丁目8番38号,https://www.zeimusoudansitu.com/contact.html
石村公認会計士事務所,https://www.ishimura-kaikei.jp/,東京都渋谷区恵比寿西1-18-3 フルービュービル6階,https://www.ishimura-kaikei.jp/mail.html
大野木総合会計事務所,http://www.ohnogi-cpa.co.jp/corporation/corporation_03outline.html,東京都港区虎ノ門1-2-20 第3虎の門電気ビルディング10F,https://www.ohnogi-cpa.co.jp/contact/
藤森税理士事務所,http://www.fujimori-tax.com/,東京都中央区京橋3-9-2宝国ビル８階B号,https://www.fujimori-tax.com/toiawase.html
税理士法人ごとう会計,http://www.goto-kaikei.co.jp/,愛知県豊川市蔵子6丁目3番地7,https://www.goto-kaikei.co.jp/contact
色木路貴税理士事務所,http://www.iroki-tax.com/,北海道札幌市北区北7条西2丁目6番地　37山京ビル7階703号室,https://iroki-tax.com/contact_free/
さくら中央税理士法人,http://www.ysd21.com/,東京都中央区日本橋蛎殻町1-29-5　ビルックスNO.2　9F,https://ysd21.com/%e3%81%94%e7%9b%b8%e8%ab%87%e3%81%ae%e6%b5%81%e3%82%8c
横田税務会計事務所,http://www.ykss.com/,東京都大田区東馬込1-12-12,https://www.ykss.com/contact/index.php
菅谷賢一税理士事務所,http://www.sugayakaikei.com/,愛知県名古屋市中区松原2丁目20番19号,https://sugayakaikei.com/%e3%81%8a%e5%95%8f%e3%81%84%e5%90%88%e3%82%8f%e3%81%9b/
井上税務会計事務所,http://www.ictao-fic.com,山梨県甲府市幸町4-2,https://ictao-fic.com/service/tax01
税理士法人 FP総合研究所,http://www.fp-soken.or.jp/,大阪府大阪市中央区本町3丁目4番10号 本町野村ビル3階,https://www.fp-soken.or.jp/contact/
中嶌大会計事務所,http://www.hero-nakajima.com/,奈良県奈良市芝辻町 4-11-8,https://www.hero-nakajima.com/cathand/otoiawase.php?serial=03906
京都あおい税理士法人,http://www.kyoto-aoi.or.jp/,京都府京都市伏見区竹田藁屋町75番地,https://www.kyoto-aoi.or.jp/form/kyoto-aoiorjp/contact
谷税理士法人,http://www.tax-plan.jp/,京都府向日市上植野町切ノ口20-5,https://www.tax-plan.jp/inquiry/
佐々木康二税理士事務所,http://www.kakekomi-sasaki.com/,兵庫県神戸市中央区北長狭通３丁目－６－４　 ＳＫビル８０２号,https://www.kakekomi-sasaki.com/contact.html
株式会社近田会計事務所,https://kondakaikei.com/,青森県八戸市根城八丁目６−１１,https://kondakaikei.com/inquiry/
西 和弘 税理士事務所,https://www.kaikei-home.com/west/,大阪府堺市堺区新町5-32 新町ビル501号,javascript:void(0);
税理士法人　向田会計,http://www.mukaida-kaikei.co.jp/,群馬県桐生市末広町6-10　MSビル2F,https://www.omakase-souzoku.jp/
税理士法人紫峰会　阿久津事務所,http://www.akutsu-aaa.com/,茨城県古河市女沼334-3,https://www.akutsu-aaa.com/form/akutsu-aaacom/inquiry
湯原税務会計事務所,http://www.yuhara-kaikei.com/,茨城県土浦市上高津826-5,https://www.yuhara-kaikei.com/form/yuhara-kaikeicom/inquiry
出口会計事務所,http://www.deguchi-ao.com/,茨城県潮来市日の出8丁目4番地17　ライジングビル2F,https://www.deguchi-ao.com/form/deguchi-ao/contact
税理士法人タックス・イバラキ,http://www.tax-ibaraki.com/,茨城県神栖市奥野谷2031,https://www.tax-ibaraki.com/form/tax-ibarakicom/inquiry
藁総合会計事務所,http://www.warakaikei.com/,東京都品川区戸越2－5－3ウェルマン戸越3階,https://www.warakaikei.com/index.php/Inheritance
根本会計事務所,http://www.officen.net/,東京都台東区台東4-10-2 岩瀬ビル3F,https://www.officen.net/cgi-bin/contact/index.cgi
亀谷税務会計事務所,http://xn--skq9ns22m32b.tokyo/about.htm,東京都新宿区新宿5-4-1 新宿Ｑフラットビル409,https://xn--skq9ns22m32b.tokyo/contact.htm
平山税理士事務所,http://www.hirayamajimusho.com/,東京都西多摩郡瑞穂町長岡1-23-5,https://www.hirayamajimusho.com/form/hirayamajimushocom/inquiry
杉村税務会計事務所,http://www.sugimurakaikei.com/,東京都町田市森野2-31-13　YABEビル201,https://www.sugimurakaikei.com/#contact-area
安藤雄一郎税理士事務所,http://www.bizup.jp/tax/ando/,神奈川県相模原市南橋本2-4-16　アプレ南橋本駅前アーバンフォレスト204,https://www.bizup.jp/tax/ando/contact.html
いいぬま税理士事務所,http://iinumazeirishizimusyo.jp/,東京都青梅市新町4-3-13　パフェオ新町101,https://iinumazeirishizimusyo.jp/service/s-souzoku/
アルメリア税理士法人,http://www.armeria-tax.jp,千葉県千葉市弁天１－１６－９　T-FORTアネックス,https://www.armeria-tax.jp/jp/page_contact.html
藤澤経営税務会計事務所,http://fuji-tax.jp/,神奈川県横浜市西区高島2-10-13横浜東口ビル608,https://fuji-tax.jp/contact/
税理士法人まこと会計,http://www.makoto-ac.jp/pc/free1.html,神奈川県川崎市中原区新丸子町911BRAVI武蔵小杉501号,https://www.makoto-ac.jp/form/makoto-acjp/inquiry
株式会社アクセンティア　細谷智之税理士事務所,http://www.hosoya-kaikei.jp/,千葉県野田市岩名２丁目８−２８,https://www.hosoya-kaikei.jp/form/hosoya-kaikeijp/inquiry
税理士法人ときわ 鈴木隆夫事務所,http://www.s-takao.com/,千葉県柏市柏5-3-1,https://www.s-takao.com/form/s-takaocom/inquiry
株式会社ケーヨー総研,http://www.kojimakaikei.co.jp/,千葉県船橋市夏見2-14-1,https://www.kojimakaikei.co.jp/contactus
税理士法人キャンバス,http://www.koshikawakaikei.com/pc/free1.html,埼玉県上尾市上町一丁目1番15号市川ビル5階,https://www.koshikawakaikei.com/web-consultation
兼田博税理士事務所,https://www.kanedahiroshi-tax.com/,埼玉県草加市氷川町2152-2 クレドール草加209,https://www.kanedahiroshi-tax.com/contact/
税理士法人　柴会計,http://www.shibakaikei.com/,埼玉県川越市新宿町5丁目7番地15,https://www.shibakaikei.com/form/shibakaikeicom/inquiry
むさし税理士法人,http://www.isi-tax634.com/,埼玉県東松山市西本宿1968-1,https://www.isi-tax634.com/about
ＡＳＡＫ浅岡会計事務所,http://www.asaoka-kaikei.com/,愛知県名古屋市中区金山一丁目4番4号 第9タツミビル東棟9階,https://asaoka-kaikei.com/consultation/
税理士法人パートナーズ,https://zei-partners.com/,愛知県名古屋市緑区大高町字南休山2番地の118,https://zei-partners.com/contact.html
明日翔ナレッジワーカーズ 税理士法人,http://www.asuka-tkc.com/,愛知県名古屋市天白区塩釜口2丁目1515番地,https://www.asuka-tkc.com/form/asuka-tkccom/inquiry
税理士法人 ひまわり,https://tax-himawari.or.jp/,愛知県豊橋市神野新田町字ヨノ割７９番地１,https://tax-himawari.or.jp/contact/
竹内孝税理士事務所,http://www.t-takeuchi.net/,愛知県安城市大東町14番11号,https://www.t-takeuchi.net/contact/index.html
大山税理士事務所,http://www.oyamataxlawyer.com/,愛知県安城市御幸本町14-14 日新堂書店2F,https://oyamataxlawyer.com/contact
浅井会計事務所　有限会社J.P,http://www.asai-kaikei.com/,愛知県一宮市八幡1-2-2,https://www.asai-kaikei.com/form/asai-kaikeicom/20160623153627
税理士法人ＣＤＡ,https://www.cda-tax.com/,大阪府大阪市中央区平野町2丁目1番14号　ＫＤＸ北浜ビル9階,https://www.cda-tax.com/contact/
MSC税理士法人,https://www.msc-tax.or.jp/,大阪府大阪市中央区北浜2丁目2番22号北浜中央ビル5F,https://www.msc-tax.or.jp/20211219050800
税理士グループ　PROTAAG,http://www.protaag.com/,京都府京都市下京区東洞院通松原上ル燈籠町599番地1,https://www.protaag.com/contact
株式会社トマック／税理士法人Jタックス,https://www.jec.gr.jp/,富山県富山市牛島新町5-5 インテックビル（タワー111）10階,https://www.jec.gr.jp/contact/
税理士法人ＭＡＣ,https://www.mackaikei.jp,兵庫県三木市緑が丘町中1丁目8-42,https://mackaikei.jp/contact/
西村史也税理士事務所,http://www.nisimura-fumiya.com/,山口県岩国市麻里布町6-13-5河本ビル2F,https://www.nisimura-fumiya.com/form/nisimura-fumiyacom/contact#ttl-form
木原敬吉税理士事務所,http://www.kiharaoffice.jp/,福岡県飯塚市西町４－５１,https://www.kiharaoffice.jp/contact/
株式会社マスネットワーク,http://www.souzoku-shinsyu.com,長野県松本市巾上9番9号,https://www.souzoku-shinsyu.com/contact.html
野原明元税理士事務所,http://www.noharaoffice.jp/,東京都杉並区永福3-56-5,https://www.noharaoffice.jp/contact/
長井良行税理士事務所,http://www.nagaizeirishi.com/,東京都板橋区大山東町59-10,https://www.nagaizeirishi.com/form/nagaizeirishicom/inquiry
司法書士・税理士高柳総合事務所,https://www.taka-office.jp/,東京都江東区海辺17-4,https://www.taka-office.jp/contact/
江川貴裕税理士事務所,http://www.egawa.gr.jp/,東京都文京区白山1-33-8-301,https://www.egawa.gr.jp/taxanswer.htm
株式会社竹の塚経営コンサルタンツ,https://www.takekon.com/,東京都足立区竹ノ塚1-17-17,https://www.takekon.com/form/takekoncom/inquiry
柳原税理会計事務所,http://www.y-ta.jp/,東京都豊島区池袋４丁目２９番地１号手塚ビル２Ｆ,https://www.y-ta.jp/yta_works4.html
増田浩美税理士事務所,http://www.zeimukaikei.jp/,東京都板橋区舟渡2丁目19-6　戸田橋浴場ビル,https://www.zeimukaikei.jp/contact/
讃良周泰税理士事務所,http://sagara-k.jp/,東京都練馬区練馬4-15-18　アプレシティ豊島園502号室,https://sagara-k.jp/contact/index.html
富澤税理士事務所,http://www.taxjp.com/,神奈川県横浜市中区翁町1-6-7 関内伊藤ビル4階,https://taxjp.com/contact/
税理士法人　押田会計事務所,http://www.oshidakaikei-tms.or.jp/,神奈川県横浜市西区南幸2-19-4　折目ビル4階,https://www.oshidakaikei-tms.or.jp/form/oshidakaikei-tmsorjp/page2
藤尾威文税理士事務所,http://www.fujio-office.com/,神奈川県小田原市成田 503-4,http://www.fujio-office.com/form/fujio-office/contact
小金澤会計事務所,http://koganecchi.com/,神奈川県藤沢市藤が岡1-6-2-3,https://koganecchi.com/page5.html
税理士法人やるきコンサルティング,https://www.yaruki-consulting.jp/,千葉県市川市八幡3-8-17　ウッドパークヤワタ　1階,https://www.yaruki-consulting.jp/form/yaruki-consultingjp/inquiry
鈴木健太郎税理士事務所,http://www.suzukiken.net/,埼玉県さいたま市見沼区東大宮1-11-13,https://www.suzukiken.net/form/suzukikennet/inquiry
シンワ税理士法人,http://www.shinwa-gr.ne.jp/,愛知県名古屋市中区錦1丁目17番26号　ラウンドテラス伏見　6階,https://shinwa-gr.ne.jp/contact
税理士法人 松井会計事務所,http://matsuikaikei.com/,愛知県田原市田原町南晩田21-3,https://matsuikaikei.com/toiawase.html
倉田会計事務所,http://www.kuratakaikei.net/,静岡県浜松市北区三方原町785-5,javascript:openwin('photo_news/popup.php?id=1103864f19007a00c9%27)
イワサキ経営グループ,http://www.tax-iwasaki.com/others01.html,静岡県沼津市大岡984-1,https://www.tax-iwasaki.com/inquiry/
さかい税理士事務所,http://www.eizoku.jp/,愛知県岡崎市六名本町6-23　小野ビルD号室,https://www.eizoku.jp/form/eizokujp/inquiry
継栄クリニックグループ,http://www.kck88.com/,大阪府大阪市中央区瓦町3丁目4番8号アサヒビル,https://www.kck88.com/soudan/index.html
遠藤忠省税理士事務所,http://www.endo-zeiri.com/,大阪府大阪市北区南森町2-1-20南森町エンシンビル901,https://endo-zeiri.com/contact/
森芳人税理士事務所,http://www.morikei.co.jp/,大阪府大阪府大阪市大正区三軒家東1丁目8番11号,https://www.morikei.co.jp/service#link03
小辰克彦税理士事務所知恵と力社労士事務所,http://www.chietochikara.co.jp/,大阪府大阪市西区北堀江１－１－４長堀新興産ビル１０Ｆ,https://www.chietochikara.co.jp/contact.html
菅俊晴税理士事務所,http://suga-tax.net/,大阪府大阪市中央区南新町1-1-1EXA南新町ビル7階,https://suga-tax.net/contact/index.php
スリーウェル経営-酒井・津田税理士事務所-,https://3-wel.com/,大阪府枚方市津田東町3-14-2,https://3-wel.com/contact/
埇田弘之（そねだひろゆき）税理士事務所,http://www.soneda-tax.com/,奈良県奈良市学園北1丁目1-12　和幸ビル3階,https://www.soneda-tax.com/form/soneda-taxcom/inquiry
生駒税理士事務所,http://www.ikoma.gr.jp/,兵庫県豊岡市弥栄町1番10号　生駒事務所1F,https://ikoma.gr.jp/service/s06/
菅野淳税理士事務所,http://sugano-tax.jp/,大阪府大阪市北区西天満2丁目8番5号　西天満大治ビル3階,https://sugano-tax.jp/%e3%81%8a%e5%95%8f%e3%81%84%e5%90%88%e3%81%9b/
福本貴子税理士事務所,http://fu-kaikei.boo.jp/,兵庫県西宮市小松西町1丁目1-2-201,tel:0798-48-9030
豊田栄治税理士事務所,https://www.toyota-kaikei.com/,岡山県岡山市北区西古松2-2-15丸山ビル1F,https://www.toyota-kaikei.com/flow/
大内和明税理士事務所,http://ouchikaikei.com/index.html,岡山県倉敷市沖新町40-10,https://ouchikaikei.com/contact.html
株式会社ブレーン　中村久雄税理士事務所,http://brain-nakamurakaikei.co.jp/,香川県高松市今里町1丁目28番地5,https://brain-nakamurakaikei.co.jp/contact/
早崎税理士事務所,http://www.hayasaki.jp/,東京都千代田区麹町2丁目14番地2 麹町NKビル１階,https://hayasaki.jp/contact-page
石田税務会計総合事務所,http://www.ishida-taxacc.jp/,東京都中央区日本橋茅場町3-13-3興和日本橋ビル 5F,http://www.ishida-taxacc.jp/other/multi.html
税理士法人TOS佐々木会計,http://www.tax-sasaki.com/,神奈川県横浜市南区井土ヶ谷上町２１番１６号,https://www.tax-sasaki.com/inquiry/inq-s.html
税理士法人岸会計,http://www.kishizeirishi.jp/,神奈川県横浜市緑区中山一丁目3番3号,https://www.kishizeirishi.jp/contact/
阿波税理士事務所,http://www.anami-zeiri.com/,大阪府東大阪市西石切町1-4-8,https://www.anami-zeiri.com/contact
廣井増生税理士事務所,http://www.tax-hiroi.com/,京都府京都市上京区今出川通小川東入南兼康町334番地,https://www.tax-hiroi.com/inquiry/index.php
税理士法人 竹長会計,http://takenaga.jp/,福井県敦賀市中央町1丁目8-33,https://takenaga.jp/?page_id=393
有限会社けやき会計事務所,https://www.keyaki-accounting.com/,宮城県仙台市宮城野区幸町５－４－１渡幸ベルメゾン幸町１－２０６,https://www.keyaki-accounting.com/
土屋みどり税理士事務所,http://mid-zei.biz/,東京都江戸川区瑞江2-5-21 サイトウビル302,https://mid-zei.biz/contact
税理士法人中央総研(名古屋本部),http://www.cri-nagoya.com/,愛知県名古屋市中区丸の内二丁目19番24号 中央総研BLD.,https://www.cri-nagoya.com/contact/
林会計事務所,http://1st-taxaccount.com/,東京都世田谷区代田5-17-5 カーラ下北沢Ⅱ202号,mailto:hayashi-kaikei@galaxy.ocn.ne.jp
税理士法人 杉井総合会計事務所,https://www.sugiikaikei.com/,大阪府松原市高見の里4丁目5番33号,https://www.sugiikaikei.com/contact
川口士郎税理士事務所,http://www.kawaguchi-tax.jp/index,愛知県名古屋市熱田区三本松町7番1号　熱田ビル1階,https://www.kawaguchi-tax.jp/library/52d4e81fcdb2d0f732000013/587876eac6461d42496a3f0e.pdf
