会社名,URL,住所,お問合せURL
税理士法人アレックスパートナーズ,https://www.toshikaikei.biz/,戸塚東2丁目1番26号竹村ビル2B,https://www.toshikaikei.biz/call/
横浜中央税理士法人,http://www.yckz.co.jp/,神奈川県横浜市南区山王町3-24-8港横浜ビル6F,https://www.yckz.co.jp/contact
税理士法人テラス,https://trc-tax.com/company,東京都中央区銀座8-17-5 THE HUB 銀座 OCT（旧アイオス銀座）10階,https://trc-tax.com/contact
税理士法人 トップ,http://www.top-zeirishi.net/,静岡県沼津市千本緑町2-10-1,https://www.top-zeirishi.net/form/top-zeirishinet/inquiry
PlusA税理士法人,https://plusa-inc.jp/,大阪府大阪市西区西本町1丁目13-47 新信濃橋ビル5F,https://plusa-inc.jp/contact/
P&H税理士事務所,http://takatsuki-sogyo.com/page-20,大阪府高槻市紺屋町7-8　コスミティⅢ高槻301号室,https://takatsuki-sogyo.com/page-31
吉田一仁税理士事務所,http://tax.yoshidakazuhito.net/,東京都世田谷区三軒茶屋１丁目６−４,https://tax.yoshidakazuhito.net/contact
税理士法人山下会計事務所,https://www.heart-y.com/,兵庫県たつの市揖西町小神20-1,https://www.heart-y.com/contact/
ソルト総合会計事務所,http://salt-cpa.com/,山口県防府市天神1丁目5-23中村ビル4階-1,https://salt-cpa.com/contact/
ミカタ税理士法人 ミカタコンサルティング株式会社,http://www.c-sbc.co.jp/,大阪府大阪市北区太融寺町3-24 日本生命梅田第二ビル3F,https://mikata-c.co.jp/contact.html
ビジョナリー会計事務所,http://www.yamamoto-tax.jp/,滋賀県大津市一里山1-6-23いづみビル4F,https://www.yamamoto-tax.jp/form/
税理士法人総和,http://www.m-partners.jp/,東京都港区南青山3-17-14 中山ビル4階,https://www.m-partners.jp/flow/
税理士法人ティームズ,http://teams-tax.com/,大阪府大阪市北区西天満5丁目1番1号 ザ・セヤマビル8階,https://teams-tax.com/contact
税理士法人 葵パートナーズ,http://aoi-p.biz,愛知県名古屋市中区正木3-13-17　BPRレジデンス金山1F,https://aoi-p.biz/contact
TOMA税理士法人,https://toma.co.jp/,東京都千代田区丸の内1-8-3　丸の内トラストタワー本館3階,https://go.toma.co.jp/l/724703/2019-10-04/3jy14
大成経営コンサルティンググループ,http://www.taiseikeiei.co.jp/,熊本県熊本市南区田井島1-3-50  ガレリアⅡ,https://www.taiseikeiei.co.jp/taxation/consult
税理士法人関内会計,https://www.kannaikaikei.jp/,神奈川県横浜市中区住吉町1-14 第一総業ビル3階,https://www.kannaikaikei.jp/contact
川村会計事務所,http://www.kawamura-tax.jp/,大阪府堺市堺区戎之町西1-1-6 ITKビル2F,https://www.kawamura-tax.jp/contact
税理士法人 末松会計事務所,http://sue-tax.com/,愛知県名古屋市東区東桜二丁目3番14号,https://sue-tax.com/contact/
SMC税理士法人／株式会社SMC総研,http://www.smc-g.co.jp/,東京都中央区八丁堀2-8-2　八丁堀共同ビル 502,https://www.smc-g.co.jp/contact
税理士法人福島会計,https://www.fukushima-ta.jp/,東京都千代田区神田駿河台3-6-1　菱和ビルディング3階,https://www.flair-ta.jp/service/flow
ビジョン税理士法人,https://suzuki-tax.net/,神奈川県横浜市戸塚区品濃町549番地2　三宅ビル3階,https://suzuki-tax.net/contact/
株式会社ビジネスプラン ／ 安野公認会計士税理士事務所,http://annokaikei.com/,島根県益田市高津一丁目1番1号,https://annokaikei.com/contact
KVI税理士法人,http://www.kvi.ne.jp/,大阪府大阪市北区天神橋2-5-25　若杉グランドビル6階,https://kvi.ne.jp/inquiry/
サン共同税理士法人,https://tax-startup.jp/,東京都港区南青山1-1-1　新青山ビル東館15階,tel:050-1707-1544
屋税理士事務所,https://okutax.com/,東京都新宿区新宿5-9-12 IDOshinjuku1階,https://okutax.com/contact.html
税理士法人キャスダック,https://www.dentax.jp,大阪府大阪市北区梅田二丁目4-9 ブリーゼタワー25F,https://www.dentax.jp/mail_main/captmail.cgi
税理士法人恒輝　榎本会計事務所,http://www.ecg.co.jp/,東京都墨田区両国3-25-5JEI 両国ビル3F,https://www.ecg.co.jp/contact/
フロンティア総合会計事務所,http://frontier-tax.com,香川県高松市木太町3049-16,https://frontier-tax.com/contact.html
税理士法人わかば,http://www.wakaba-tax.com/,東京都町田市森野1-33-11　町田森野ビル1F,https://www.wakaba-tax.com/service/souzoku.html
税理士法人MIRAI,http://www.sawatax.com/,秋田県秋田市土崎港南2-3-64,https://www.sawatax.com/form/sawataxcom/inquiry
いっしょに税理士法人,https://isshoni.co.jp/,東京都渋谷区恵比寿1-8-6 共同ビル4階,https://isshoni.co.jp/contact/
松尾会計事務所,http://www.m-accounting-firm.com/,兵庫県西宮市神楽町5番5号　ラ・ベルジュ夙川2Ｆ,https://m-accounting-firm.com/contact/
税理士法人青木&パートナーズ,http://www.aoki-p.co.jp/,宮城県仙台市宮城野区榴岡4-3-10　仙台TBビル4階,https://www.aoki-p.co.jp/contact-us/index.html
野々口会計事務所,http://www.taxoffice-n.com/,大阪府大阪市東成区大今里西 3丁目3番11号,https://www.taxoffice-n.com/contact/
山内会計事務所,https://kanazawa-setsuritsu.com/,石川県金沢市西念3丁目29-32,https://kanazawa-setsuritsu.com/flow-2/
中野会計事務所,https://nakanotax.com/,東京都武蔵野市吉祥寺南町2-6-11　尾崎ビル4階,https://nakanotax.com/office/contact/
税理士法人山岸会計,http://www.zyamagishi.jp/,東京都新宿区神楽坂2-16　軽子坂田中ビル,https://www.zyamagishi.jp/form/zeirishihouzin-yamagishi/contact
糸井会計事務所,http://www.v-spirits.com,東京都墨田区江東橋4-24-5　協新ビル7階,https://v-spirits.com/impression
森田税理士・社労士事務所,https://m-zj.com/,東京都千代田区神田小川町1-1-15　Ｄ&Ｆ御茶ノ水ビル６F,https://m-zj.com/contact/contact.html
三輪厚二税理士事務所,http://www.zeirishi-miwa.co.jp/,大阪府大阪市中央区備後町2-4-6　森田ビル1階,https://www.zeirishi-miwa.co.jp/toiawase.html
税理士法人 新納会計事務所,http://www.shinnou.net/,京都府京都市中京区新町通二条下る頭町16-1,https://www.shinnou.net/form/sinnnou/form01
笘原拓人税理士事務所,http://www.t-taxfirm.com/,愛知県名古屋市中区正木4丁目8番7号　れんが橋ビル7F,https://t-taxfirm.com/contact/
税理士法人コモンズ,http://www.e-tax24.jp/,大阪府大阪市中央区内淡路町3丁目2番15-403,https://e-tax24.jp/form/
税理士法人ミライト・パートナーズ,http://www.milight.co.jp/,大阪府大阪市北区梅田1-1-3 大阪駅前第三ビル31階,https://www.milight.co.jp/service/
大沢会計事務所,http://www.osawakaikei.jp/,埼玉県越谷市越ヶ谷2617,https://www.osawakaikei.jp/category/2001265.html
石田雄二税理士事務所,http://www.kaikeisanbo.com/,広島県広島市南区的場町１－１－２１ クリスタルタワー３Ｆ,https://www.kaikeisanbo.com/contact/
新橋税理士法人,https://shinbashitax.tokyo/,東京都港区西新橋1-16-4 ノアックスビル2階,https://shinbashitax.tokyo/contact
白川浩平税理士事務所,http://shirakawa-office.com/,高知県高知市堺町2-26高知中央ビジネススクエア8階,https://shirakawa-office.com/inquiry/
松尾友平税理士事務所,https://www.matsuo-tax.com/,長崎県長崎市興善町7-7,https://www.matsuo-tax.com/contact
税理士法人ASC,https://www.ascinc.co.jp/,東京都港区芝浦3丁目16番4号山田ビル3階,https://www.ascinc.co.jp/contact/?afkey=
T＆A税理士法人　原町田中央事務所,http://tax-help.jp/,東京都町田市原町田3丁目2番1号　原町田中央ビル５F,https://tax-help.jp/contact.html
山口拓税理士事務所,http://www.yamaguchitaku-office.com/,大阪府大阪市中央区大手通1丁目2番8号エースマン大手通ビル302,https://www.yamaguchitaku-office.com/form/yamaguchitaku-officecom/inquiry
山口税理士事務所,http://yamaguchi-tax.biz/,栃木県佐野市田沼町490番地10,https://yamaguchi-tax.biz/freeadvice.html
税理士法人田子会計事務所,http://www.tagokaikei.jp/,群馬県前橋市東上野町94,https://www.tagokaikei.jp/contact
税理士法人イデアコンサルティング,http://ideaconsulting.jp,東京都渋谷区恵比寿4-20-3　恵比寿ガ―デンプレイスタワ―15階,https://ideaconsulting.jp/contact
ウィズグロース会計事務所,http://yokohama-fujiwarakaikei.com/,神奈川県横浜市神奈川区鶴屋町3-29-1 TSURUYA-CHO HEIGHTS 1104,https://yokohama-fujiwarakaikei.com/contact/
株式会社みどりクラウド会計,https://zeishop.com,香川県高松市栗林町1丁目18-30,https://zeishop.com/contact/
近藤正臣公認会計士事務所,http://www.kondo39.com/,愛知県名古屋市東区東大曽根町24-4　野村ビル1階,https://www.kondo39.com/category/1158722.html
中川税理士事務所,http://www.nakagawa-firm.com/,福岡県春日市光町3丁目131番地,https://nakagawa-firm.com/inquiry/
小野孝義税理士事務所,http://www.onotax.jp/,福岡県福岡市中央区渡辺通1丁目12番9号　渡辺通フジイビル302号,https://www.onotax.jp/good#page_contact
松本会計事務所,https://kaigokeiei.net/kigyou/index.php?FrontPage,大阪府大阪市中央区南本町4-1-1ヨドコウビル５F,https://kaigokeiei.net/kigyou/index.php?%E7%9B%B8%E8%AB%87%E5%AE%9F%E4%BE%8B%E9%9B%86
アイネックス税理士法人,http://www.i-nex.co.jp,京都府京都市下京区烏丸通四条下る水銀屋町620　COCON烏丸5F,https://business.form-mailer.jp/fms/4d1a7ba5267478
税理士法人SHIP,https://ship-ac.jp/,愛知県豊橋市大橋通1丁目101番地,https://www.ship-ac.jp/contact
ＦＵＮ税理士法人,http://www.yama-cpa.com/,新潟県新潟市中央区上所上1-8-14,https://www.yama-cpa.com/contact/
いなほ会計,https://www.inahokaikei.com/,東京都文京区本郷2-35-17 コート本郷104,https://www.inahokaikei.com/inquiry/
濱田会計事務所,https://www.mikagecpa.com/,兵庫県神戸市中央区御幸通4-1-10　YAYA BLD8F,https://www.mikagecpa.com/archives/news/9314/
りんく税理士法人,http://www.taxlink.jp/,愛知県碧南市久沓町1-22,https://www.taxlink.jp/contact/
税理士法人たかはし事務所,http://www.t-tax.jp/,福岡県福岡市東区筥松2-28-26,tel:0926216320
税理士 小林誉光事務所,http://www.kobayashi-tax-accountant.com/,東京都杉並区上荻1-17-10 シンフォニーアンダンテ602,https://www.kobayashi-tax-accountant.com/contact/
みらい会計税理士法人,http://www.miraikaikei.or.jp/cms/about/greeting,東京都豊島区池袋2-23-24 藤西ビル別館2階,https://www.miraikaikei.or.jp/contact/
税理士法人福岡中央会計,http://www.fc-tax.com/,福岡県福岡市中央区天神5丁目7-3福岡天神北ビル３階,https://fc-tax.com/inquiry
税理士事務所べストバランス,http://www.tax-bestbalance.com/,福岡県福岡市中央区大名2-2-50　大名ＤＴビル3-B,https://taxbb.net/contact
ユナイテッドブレイン会計事務所,http://www.unitedbrain.jp/,東京都渋谷区恵比寿西2-9-8　大澤ビル4F,https://unitedbrain.jp/contact/
ことのは税理士事務所,http://cotonoha-office.jp/,東京都練馬区田柄,https://cotonoha-office.jp/inquiry/
北斗中央税理士法人,http://www.hasetax.jp/,愛知県小牧市中央五丁目203番地 小牧中央ビル1階,https://hasetax.jp/contact
山口税務会計事務所,http://www.yamaguchi-zeimu.com/,東京都日野市多摩平1-8-13 ホウユウビル2階C号,https://www.yamaguchi-zeimu.com/contact/
森川和彦税理士事務所,http://www.mcg-zei.jp/,兵庫県神戸市中央区下山手通6-1-4　オフィス下山手９階,https://www.mcg-zei.jp/contact.html
ゆたか税理士法人,http://www.yutaka-tax.com/,大阪府大阪市中央区南本町2-3-8　KDX南本町ビル3階,https://www.yutaka-tax.com/contact
税理士法人FLAP,http://www.flap-tax.jp/,大阪府大阪市北区梅田2-5-4　千代田ビル西館8F,https://flap-tax.jp/contact/
PwC社会保険労務士法人/PwC税理士法人,https://www.pwc.com/jp/ja/about-us/member/tax/labor-and-social-security-attorney-corporation.html,東京都千代田区大手町1-2-1Otemachi One タワー,https://www.resource.jp.pwc.com/inquiry
シンアカウンティングサービス株式会社,http://www.shine-accounting.co.jp/,東京都港区南青山1-1-1 新青山ビル東館15階 サン共同会計事務所内,https://www.shine-accounting.co.jp/contact-ssl/
下和田税理士事務所,https://fukuokatax.localinfo.jp/,福岡県福岡市中央区長浜１丁目２番６号天神スカイマンション407,https://fukuokatax.localinfo.jp/pages/1602951/static
L＆Bヨシダ税理士法人,http://www.yoshida-zeimu.jp/,新潟県新潟市中央区女池4丁目18-18 マクスウェル女池3F,https://www.yoshida-zeimu.jp/category/1238058.html
よねづ税理士事務所,http://www.yonezu.net/,愛知県名古屋市緑区鳴海町字有松裏200ウインハート有松３Ｂ,http://www.yonezu.net/contact
濱崎税理士事務所,http://hamasaki-tax.com/,大阪府大阪市西区北堀江1丁目5-2四ツ橋新興産ビル10階1002号,https://hamasaki-tax.com/contact/
内海会計事務所,http://www.utsumikaikei.jp/,東京都世田谷区宮坂３－１０－３,https://www.utsumikaikei.jp/contact.html
税理士法人　星野会計事務所,http://www.tax-hoshino.com/,東京都新宿区西新宿6丁目12番7号ストーク新宿410号,https://tax-hoshino.com/corporate-tax-accounting/
税理士法人サポートリンク,http://www.actax.co.jp/,神戸市中央区磯辺通3丁目1-2 大和地所三宮ビル603号B,https://www.actax.co.jp/contact/
税理士法人ゆびすい,http://www.yubisui.co.jp/,大阪府堺市堺区向陵西町4-5-5 ゆびすいビル,https://www.yubisui.co.jp/service/company/labor/
税理士法人B/Sマネジメント,http://www.bsm-ac.com/,大阪府大阪市北区西天満3-13-18　島根ビルディング5階,https://www.bsm-ac.com/contact
三反田会計事務所,http://www.santanda.com/,東京都大田区蒲田5-36-1エーコービル2F,https://www.santanda.com/contact.html
都丸税理士事務所,http://tomarutax.jp/,東京都千代田区岩本町1-2-13渡東ビルディング3F,https://tomarutax.jp/contact/
FUJITA税理士法人,http://www.fujita-tax.com/,北海道札幌市東区北七条東3-2-32井門札幌東ビル4F,https://fujita-tax.com/contact
中村太郎税理士事務所,https://www.nakamura-taro.com/,東京都新宿区西新宿7丁目4番7号 イマス浜田ビル3階,https://nakamura-taro.com/contact/
あおば税理士法人,http://www.aoba2003.com/,岡山県岡山市北区田中105番地108,https://www.aoba2003.com/form/aoba2003com/contact
税理士法人ASAMAパートナーズ,http://ichikawa-taxoffice.com/,長野県佐久市中込1267-6,https://ichikawa-taxoffice.com/contact/
税理士法人あおば会計,http://aoba-account.com/,新潟県新潟市中央区堀之内南3-1-21,https://aoba-account.com/contact/
税理士法人SASGA,http://www.sasga.or.jp/,奈良県橿原市上品寺町346-6 パリシェド21ビル,https://sasga.or.jp/contact/
村尾総合会計事務所,http://murao-kaikei.com/,大阪府大阪市西区西本町1-8-2　三晃ビル704,https://murao-kaikei.com/contact/
日本ITビジネス会計株式会社,https://web-b-tax.com/,大阪府大阪市中央区平野町1丁目7番3号 BRAVI北浜10階,https://web-b-tax.com/access/
曽我税理士事務所,https://www.soga-tax.jp/,戸部町3-94　横浜パワーハイツ2F,https://www.soga-tax.jp/%e3%81%8a%e5%95%8f%e3%81%84%e5%90%88%e3%81%9b%ef%bc%86%e7%84%a1%e6%96%99%e7%9b%b8%e8%ab%87/
金子会計事務所,http://www.kaneko-j.com/,東京都港区赤坂4－9－17　赤坂第一ビル1階,https://kaneko-j.com/inquire/
井谷吉宏税理士事務所,http://www.itani-tax.net/,京都府京都市中京区東洞院通御池下る笹屋町445番地　日宝烏丸ビル6Ｆ2号,https://itani-tax.net/contact/
梅山税理士法人 神戸事務所,http://www.umeyama-kobe.net/index.html,滋賀県草津市野路一丁目8番18号,https://umeyama-kobe.net/tcatnoc/otoiawase.html
柳澤国際税務会計事務所,http://www.yanagisawa-accounting.com/,東京都渋谷区千駄ヶ谷4-5-11 SuSLOB 北参道7F,https://www.yanagisawa-accounting.com/tax/%e5%9b%bd%e9%9a%9b%e7%a8%8e%e5%8b%99%e7%9b%b8%e8%ab%87/
L&Bヨシダ税理士法人,https://www.yoshida-zeimu.jp/,新潟県新潟市中央区女池4丁目18-18マクスウェル女池2F,https://www.yoshida-zeimu.jp/category/1238058.html
税理士法人 中山会計,https://nakayama-kaikei.com/,石川県金沢市有松2-9-18,https://nakayama-kaikei.com/mail/
花房・広田税理士法人,https://hirotax.jp/,東京都渋谷区桜丘町4-17 PORTAL Apartment & Art POINT 1102,https://hirotax.jp/contact-2/
代官山税理士法人,https://blp-tax.com/,東京都港区六本木丁7目15番7号 新六本木ビルSENQ六本木601,https://blp-tax.com/en/contact
株式会社エーエスシー,http://www.ascinc.co.jp,東京都港区芝浦3丁目16-4  山田ビル3階,https://www.ascinc.co.jp/contact/?afkey=
税理士森福会計事務所,https://www.morifuku.jp,大阪府和泉市唐国町1丁目8番25号,https://www.morifuku.jp/918454195
ベンチャーサポート税理士法人,https://vs-group.jp/tax/,東京都渋谷区 渋谷1丁目15-21 ポーラ渋谷ビル8階,https://venture-support.biz/tax/ask
成和税理士法人 広事務所,http://www.seiwa-tax.com/,広島県呉市広古新開1-2-40,https://seiwa-tax.com/contact/
グッドエフェクト税理士法人,http://www.zeirisihoujin.com/,大阪府豊中市新千里東町1丁目2番4号 信用保証ビル5F,https://zeirisihoujin.com/page-33/
横山会計事務所,https://www.yokoyama-tax.net/,神奈川県横浜市神奈川区金港町5-36 東興ビル702号,https://yokoyama-tax.net/contact/
Rikyuパートナーズ税理士法人,http://www.tax-110.com/,東京都千代田区内神田1-15-7GRANDIR OTEMACHI 507,https://www.tax-110.com/contact/
あすか税理士法人,http://www.asuka-zeirishi.com/,北海道札幌市中央区大通西14丁目1番14号 NEO BLD.2F,https://www.asuka-zeirishi.com/contact-form
吉澤税務会計事務所,https://at-brain.com/,埼玉県草加市吉町1-3-37,https://at-brain.com/adviser/course
坂下国際税理士法人,http://www.bygones-tax.com/index.html,東京都渋谷区千駄ヶ谷3-38-5 YFLビル2F,https://bygones-tax.com/contact.html
高岸税務会計事務所,http://www.gishitax.com/,大阪府高槻市高槻町9番19号カサノブレ202,https://www.gishitax.com/freeper.html
ファーストアカウンティング江原会計,http://www.eharakaikei.com/,栃木県足利市朝倉町2-1-7,https://eharakaikei.com/contact/
齋藤会計事務所 株式会社アップコンサルティング,http://www.saitax.jp/,東京都豊島区池袋2丁目14番4号 池袋ＴＡビル2階,https://www.saitax.jp/form/saitaxjp/inquiry
中村 健  税理士事務所,https://www.nakamurakaikei.com/,静岡県浜松市中区北寺島町125ｰ23,https://www.nakamurakaikei.com/toiawase.html
磯貝会計事務所,http://isogai2.sakura.ne.jp/,兵庫県尼崎市塚口町1-33-26,https://isogai.net/contact
後藤会計事務所,http://www.goto-ac.com/,東京都新宿区新宿2-4-16 栄幸ビル6Ｆ,https://www.goto-ac.com/inquiry.php
有限会社顧問料不要の三輪会計事務所,http://www.miwakaikei.com/,大阪府大阪市中央区備後町2-4-6　森田ビル1階,http://www.zeirishi-miwa.co.jp/toiawase.html
ゆう税理士事務所,http://u-accounting.jp/,兵庫県神戸市中央区東町123-1貿易ビル1階2号室,https://u-accounting.co.jp/otoiawasenituite.html
株式会社Rainbow Cloud,http://keiri-omakase.jp/,東京都豊島区高田3-14-29KDX高田馬場ビル602号室,https://keiri-omakase.jp/contact/
ＳＭＴコンサルティング株式会社,https://www.smt-c.jp/,熊本県熊本市中央区水前寺5-15-15,https://smt-c.jp/contact
木島圭亮税理士事務所,http://setagaya-kigyo.com/,東京都世田谷区太子堂4ｰ7ｰ4セラピュアビル5階,https://expireddomains.com/contact
神野税理士事務所,http://www.k-zeirishi.net/,東京都北区浮間3丁目9-3,https://www.k-zeirishi.net/consultation/
野垣浩公認会計士・税理士事務所,http://www.nogaki.jp/,大阪府池田市室町4-52ロイヤルグラン池田401号,https://www.nogaki.jp/form/nogakijp/contact
山口雅文税理士事務所,http://www.yamaguchi-tax.com/,福岡県福岡市中央区薬院3丁目12-10 ネオハイツ薬院1202号,https://www.yamaguchi-tax.com/free7
税理士法人経営支援,https://www.hiruta-kaikei.com/,東京都品川区西五反田8-3-6 TK五反田ビル6F,https://www.hiruta-kaikei.com/contact/#soudanshitara
吉本税理士事務所・吉本社会保険労務士事務所,http://www.yosimoto-tax.com,京都府京都市右京区太秦奥殿町29番地,https://www.yosimoto-tax.com/estimate/
税理士法人生駒会計,https://www.ikomamanabu.com,香川県高松市亀井町4-2,https://www.ikomamanabu.com/contact/
サクセス会計事務所,http://success-a.com/,大阪府大阪市中央区北久宝寺町1-7-9堺筋本町プラザビル303号,https://success-a.com/#kobetu
Aimパートナーズ総合会計事務所,https://www.office-ebina.com/,北海道札幌市西区西野2条5丁目6番5号Aim.BLD,https://office-ebina.com/contact/
京都むらさきの総合税理士法人,http://kmcs.co/,京都府京都市北区紫野東御所田町9番地,https://kmcs.co/contact
福井税務会計事務所,http://www.fukui-jp.com/,佐賀県佐賀市駅前中央3-15-7　ビズアカウンティングビル2F,https://www.fukui-jp.com/%e3%81%8a%e5%95%8f%e3%81%84%e5%90%88%e3%82%8f%e3%81%9b/
税理士法人T-FRONT,http://www.tax-front.jp/,愛知県名古屋市天白区原1-210 原コーネルビル2C,https://liff.line.me/1645278921-kWRPP32q/?accountId=922bzftp
高橋輝雄税務会計事務所,https://teruozeimu.com/,東京都中央区新川1-3-21 BIZSMART茅場町4F,https://teruozeimu.com/spotsoudan/
土谷税理士事務所,http://www.tsuchiyatax.jp/,東京都中野区中野3-36-13 サトービル3階,https://www.mt-trusttax.or.jp/contact
酒井税理士事務所,https://sakai-zeirishi.com/,東京都江戸川区西瑞江５丁目12−５　メゾンドプチラメールV202,https://sakai-zeirishi.com/contact/
古屋総合事務所,http://faccount.jp/,東京都新宿区新宿4-3-17FORECAST新宿SOUTH3階　CROSSCOOP 内307,https://faccount.jp/contact/
高瀬麗子税理士事務所,http://www.officereiko.com/,愛知県豊橋市一色町字一色上17番地,https://www.officereiko.com/form/index.html
藤本会計事務所,http://af-tax.jp/,兵庫県神戸市西区押部谷町栄２７４,https://af-tax.jp/contact
阿部尚武税理士事務所,https://www.abekaikei.com/,千葉県千葉市花見川区幕張本郷１丁目2番24号幕張本郷相葉ビル7F,https://www.abekaikei.com/inquiry/
税理士法人思惟の樹事務所,http://www.shiinoki.or.jp/,群馬県高崎市小八木町2031-4,https://www.shiinoki.or.jp/form/shiinokiorjp/contact
西山税理士事務所,https://www.ezei.jp,東京都板橋区南常盤台2-14-7　ナチュレ・シモザワ1F,https://www.ezei.jp/contact/
アマヤ・パートナーズ税理士法人,http://www.amaya.co.jp/,東京都港区三田3-14-10 三田3丁目MTビル6F・9F,https://www.amaya.co.jp/contact/
フロンティア税理士事務所,http://www.frt-office.jp/,京都府京田辺市田辺中央1-5-5　橋本ビル2階,tel:0774-66-3075
小西税務会計事務所,https://konishi-tax.com/,埼玉県さいたま市南区根岸5丁目15-8 ＹＫビル 5Ｆ,https://konishi-tax.com/contact/
速水芹苗税理士事務所,https://serina-tax.com/service/,大阪府大阪市北区大阪市西区江戸堀1-14-1,https://serina-tax.com/service/tax-consultation/
須田税理士事務所,http://www.suda-tax.com,大阪府大阪市中央区大手前1丁目7番31号 OMMビル11階,https://www.suda-tax.com/form/suda-tax/page2
高田寛税理士事務所,http://www.takada-zeirishi.com/,東京都豊島区池袋2-18-2セラミック安藤ビル403,https://www.takada-zeirishi.com/contact
税理士法人T&Aコンサルティング,https://www.ta-consulting.jp/,東京都港区三田3-4-10 リーラ聖坂1F,https://www.ta-consulting.jp/contact/
こぐれ税理士・行政書士事務所,http://www.mytax.jp/,東京都町田市原町田6-28-16 フジビル88 302号,https://mytax.jp/startup
愛和税理士法人,http://www.okada-tax.com,大阪府大阪市中央区北浜3丁目1番22号あいおいニッセイ同和損保　淀屋橋ビル７Ｆ,https://goofice.tax/contact
アクア会計事務所／アクア・フェリクス株式会社,http://aqua-cpa.biz/,神奈川県横浜市西区北幸2-10-27 東武立野ビル「3F」,https://aqua-cpa.biz/contact/
丸茂税理士事務所,http://www.marumo-tax.jp/,東京都大田区西蒲田8丁目2番1 西蒲田スカイハイツ611号,https://www.marumo-tax.jp/services/tax_consultation
原田敦税理士事務所,https://www.harada-tax.jp/,千葉県千葉市中瀬2-6-1WBGマリブイースト14階,https://www.harada-tax.jp/category/1165777.html
向原公認会計士・税理士事務所／向原ビジネスサポート合同会社,https://koga-cpa.com/ibaraki-kogac/,茨城県古河市東本町1-4-1下山ビル3F,https://koga-cpa.com/ibaraki-kogac/%e3%81%8a%e5%95%8f%e3%81%84%e5%90%88%e3%82%8f%e3%81%9b/
税理士法人　新潟会計アシスト,http://nkassist.com/,新潟県新潟市中央区長潟894-1,https://nkassist.com/contact
