会社名,サービスURL,住所,電話番号,お問い合わせURL
行政書士西島法務事務所,https://www.gyoseisyoshi-nishijima.com/,北海道札幌市中央区南4条西23丁目1-27ウェイヴ２３ 105号,,https://www.gyoseisyoshi-nishijima.com/%E3%81%8A%E5%95%8F%E3%81%84%E5%90%88%E3%82%8F%E3%81%9B/
行政書士村上労働行政事務所,https://gyoseisyoshi-murakami.com/,北海道石狩市花川南1条2丁目295番地,,https://gyoseisyoshi-murakami.com/inquiry/index.html
行政書士FP河合伸哉法律事務所,https://www.office-kawai.jp/,福井県吉田郡永平寺町松岡薬師3-85-2,,https://www.office-kawai.jp/contact
行政書士おの事務所,https://ono-office.com/,福井県福井市灯明寺3丁目4403番地1,,https://ono-office.com/contact/
高川・冨士尾 行政書士事務所,http://takagawa-office.jp/,和歌山県和歌山市松ヶ丘2丁目6-15,,https://takagawa-office.jp/contact
あなん司法書士／行政書士事務所,https://yamadaoffice.info/,徳島県阿南市日開野町谷田510-6,,https://yamadaoffice.info/inquiry/
行政書士松田法務事務所,http://gyousei-matsuda.com/,佐賀県武雄市北方町大崎2144-7,,https://gyousei-matsuda.com/contact/contact.html
南里行政書士事務所,https://www.g-nanri.com/,佐賀県杵島郡白石町坂田194-3,,https://www.g-nanri.com/contact/
行政書士法人きずな佐賀,http://office-tomino.com/,佐賀県佐賀市高木瀬西2丁目15-17 SERAI五番館 1F,,https://office-tomino.com/contact/
おか行政書士・社会保険労務士事務所,https://www.oka-office.com/,佐賀県鹿島市大字高津原4375番地 モードNEXT21ビル2F,,https://www.oka-office.com/contact/index.html
行政書士アドヴァンス法務事務所,http://advance-office.com,兵庫県神戸市中央区熊内町3-5-31　T'sコート熊内1階,,https://advance-office.com/contact
前田行政書士事務所,http://office-maeda.info,兵庫県伊丹市西台5丁目7-25土井ビル2F,,https://office-maeda.info/contact.html
おかの行政書士事務所,http://office-okano.com,広島県広島市中区白島九軒町1-14,,https://office-okano.com/#contact
社会保険労務士 行政書士 岩元事務所,http://www.rockroumu.com,東京都葛飾区高砂5-27-6-201,,https://www.rockroumu.com/contact/
酒巻行政書士事務所,http://www.sakamaki-g.com,千葉県千葉市美浜区新港202番地,,https://www.sakamaki-g.com/contact/
わさだ行政書士事務所,http://www.wasada-lawsupport.jp,福岡県福岡市城南区樋井川4丁目40-4,,https://www.wasada-lawsupport.jp/inquiry/
海原行政書士事務所,http://www.kaibara-gyosei.com,神奈川県横浜市中区太田町一丁目20番 三和ビル3-C,,https://www.kaibara-gyosei.com/inquiry/
会社設立代行＠名古屋センター,http://www.mission-nagoya.com,愛知県名古屋市天白区植田東2-1207-302,,https://www.mission-nagoya.com/contact-us/
折茂事務所,http://www.office-orimo.com,埼玉県児玉郡神川町熊野堂155-25,,https://www.office-orimo.com/contact.html
社会保険労務士法人 ルーチェ,https://sr-luce.jp/,愛知県名古屋市中区丸の内2丁目15番12号-2 ザ・テラス丸の内903号,,https://sr-luce.jp/contact/
行政書士山本法務事務所,http://moto-office.net,神奈川県高座郡寒川町岡田３丁目２３番２３号,,https://moto-office.net/f_contact.html
行政書士うどう綜合事務所,http://e-gyousei.com,熊本県山鹿市山鹿1045番地1,,https://e-gyousei.com/contact/
小野行政書士・ 社会保険労務士事務所,https://www.yakushoya-honpo.com/joseikin.html,東京都品川区東品川2-5-6　天王洲ビュータワー3106,,https://www.yakushoya-honpo.com/cgi-bin/formmail/contact.html
あさひ新日本総合法務事務所,http://www.atlo.jp,埼玉県春日部市大沼４丁目１番地,,https://www.atlo.jp/inquiry/
海事代理士・行政書士　高松海事法務事務所,http://takamatsu-office.com,神奈川県川崎市高津区久末1417番地 リブェ-ル峰美202,,https://takamatsu-office.com/contact.html
有限会社オフィスササガワ,http://www.sasa-office.com,新潟県加茂市石川2-1-22,,https://www.sasa-office.com/contact.html
折本徹行政書士事務所,http://www.toruoriboo.com,東京都世田谷区宮坂2-22-3,,https://www.toruoriboo.com/inquiry.html
税理士法人経営支援,https://www.hiruta-kaikei.com/,東京都品川区西五反田8-3-6 TK五反田ビル6F,,https://www.hiruta-kaikei.com/contact/#soudanshitara
東京ワールド行政書士事務所,http://www.tkwd.net,東京都千代田区神田佐久間町2-8,,https://www.tkwd.net/contact.html
行政書士諸田法務事務所,http://www.jiko7.jp,静岡県静岡市葵区追手町10番218-1号新中町ビル2F,,https://www.jiko7.jp/contact/
行政書士・川添国際法務事務所,http://www.gaikoku-jin.com,大阪府枚方市西禁野１丁目1-25-701,,https://www.gaikoku-jin.com/contact/
ひかり行政書士法人,http://kyoto-kika.com,京都府京都市左京区聖護院山王15番地,,https://kyoto-kika.com/contact/
行政書士うえだ事務所,http://ueda-gyo.com,千葉県千葉市稲毛区稲毛東２丁目３－９,,https://ueda-gyo.com/contact
岩本行政書士・社労士総合オフィス,http://www.isan-souzoku.com,大阪府大阪市北区西天満五丁目1番15号 西天満パークビル2号館,,https://www.isan-souzoku.com/contact/index3.html
最首総合事務所グループ,http://www.s-s-j.co.jp/gyou/index.html,千葉県千葉市中央区弁天1丁目15番1号　細川ビル4階,,https://www.s-s-j.co.jp/contact/
濱元行政書士事務所,http://www.office-hamamoto.com,大阪府大東市谷川２丁目７番９０５号,,https://www.office-hamamoto.com/contact/
吉本税理士事務所・吉本社会保険労務士事務所,http://www.yosimoto-tax.com,京都府京都市右京区太秦奥殿町29番地,,https://www.yosimoto-tax.com/contact/
庄司茂事務所,http://www.roumpro.com,兵庫県神戸市中央区中山手通5-1-1 神戸山手大木ビル6Ｆ,,https://www.roumpro.com/contact.html
縁（ゆかり）法務事務所,http://www.kaisya-soudan.com,東京都港区芝浦三丁目7番13号エスパース田町アネックス801号,,https://www.kaisya-soudan.com/contact.html
行政書士　田島事務所,http://www.t-syoshi.com,大阪府豊中市庄内東町6-4-14,,https://www.t-syoshi.com/contact.html
いずみ税理士法人,http://mac-con.tkcnf.com/pc,新潟県三条市泉新田３０２８番地,,https://mac-con.tkcnf.com/form/mac-con/inquiry
税理士法人モザワ事務所,http://www.tax-mozawa.com/pc/,新潟県長岡市川崎町568番地5,,https://www.tax-mozawa.com/form/tax-mozawacom/inquiry
篠塚行政書士事務所,http://www.meihen.jp,栃木県小山市花垣町1-13-2,,https://www.meihen.jp/contact/
税理士法人柴会計事務所,http://www.shibakaikei.jp/pc/,栃木県真岡市並木町3-11-10,,https://www.shibakaikei.jp/form/shibakaikeijp/inquiry
菊池税理士事務所,https://accounting-web.net/,茨城県日立市本宮町三丁目18番6号,,https://accounting-web.net/inquiry/1
行政書士SUZUKI合同事務所,http://www.business-counselor.net,東京都中野区弥生町3-24-11学術事務センター202号室,,https://www.business-counselor.net/contact.html
アルメリア税理士法人,http://www.armeria-tax.jp,千葉県千葉市弁天１－１６－９　T-FORTアネックス,,https://www.armeria-tax.jp/jp/page_contact.html
行政書士アイテラス法務事務所,http://gyousei-watanabe.com,千葉県柏市明原４−４−２１−１０３号室,,https://gyousei-watanabe.com/contact/
中村法務行政書士事務所,http://officenakamura.com,岐阜県大垣市今宿6-52-16ソフトピアジャパンドリーム・コア505号室,,https://officenakamura.com/contact/index.html
藤波行政書士事務所,http://www.fujinami.biz,三重県伊勢市二見町溝口425,,https://www.fujinami.biz/#contact
行政書士牛島総合事務所,http://gyu-sou.com,福岡県福岡市博多区東公園2-20　ウイング平松屋2F,,https://gyu-sou.com/index.php?%E3%81%8A%E5%95%8F%E3%81%84%E5%90%88%E3%82%8F%E3%81%9B
大地,http://www.daichi-co.net,三重県四日市市東日野町181-1,,https://www.daichi-co.net/contact.html
あかつき行政書士事務所,http://akatsuki.tekoteko.com,大阪府堺市北区黒土町20-1 サンライズSAKAI 101号,,https://akatsuki.tekoteko.com/contact/
株式会社マスネットワーク,http://www.souzoku-shinsyu.com,長野県松本市巾上9番9号,,https://www.souzoku-shinsyu.com/contact.html
西村事務所,http://www.nisi-office.com,東京都江東区東陽3-28-9　山屋東陽ハイツ904,,https://www.nisi-office.com/contact.html
斎賀会計事務所,http://www.saiga-kaikei.com/pc/,東京都江東区森下1-3-13,,https://www.saiga-kaikei.com/form/saiga-kaikeicom/inquiry
社会保険労務士　山浦事務所,http://www.office-yamaura.com,東京都千代田区内神田2-16-8　第五氏家ビル7階,,https://www.office-yamaura.com/contact/
行政書士荒牧法務会計事務所,http://www.aramaki-office.jp,東京都荒川区荒川7-34-7-302 エ-ルハイツ町屋,,https://www.aramaki-office.jp/contact.html
木村行政書士事務所,http://kimura-gyosei.com,埼玉県狭山市新狭山3‐7‐28新狭山ビル,,https://kimura-gyosei.com/contact/
和田労務管理事務所,http://www.wadaoffice.com,千葉県千葉市稲毛区穴川2-13-17,,https://www.wadaoffice.com/contact.html
門脇税務会計事務所,http://www.kadowaki-kaikei.com,神奈川県海老名市門沢橋2丁目4番33号,,http://www.kadowaki-kaikei.com/form/kadowakikaikei/contact
有限会社MSWプラニング,http://mikachin.com,神奈川県相模原市南区相武台2-17-3,,https://mikachin.com/#contact
アミ・インターナショナル行政書士事務所,http://www.ami-inter.com,大阪府岸和田市西之内町29-20,,https://www.ami-inter.com/english/contact/contact.html
株式会社エル・オフィス,http://loffice.jp,鳥取県鳥取市湖山北1丁目427番地1 西寿館 2階,,https://loffice.jp/contact/contact.html
行政書士法人 深見豪事務所,http://office-legal.org,愛媛県松山市勝山町2丁目3-1,,https://office-legal.org/contact/
行政書士山下克哉事務所,http://www.visa-office-for-asians.com,東京都豊島区池袋2-67-10-3B,,https://www.visa-office-for-asians.com/fn/contact.html
上江洲正美行政書士事務所,http://gyosei-uezu.main.jp,沖縄県那覇市字上之屋４０９−１０,,https://gyosei-uezu.main.jp/contact.html
税理士法人KMCパートナーズ,http://www.kaikeinet.jp/,東京都渋谷区道玄坂一丁目16番7号  ハイウェービル9階,,https://www.kaikeinet.jp/contact/
笹原敏浩行政書士事務所,http://office-sasahara.com,神奈川県横浜市中区長者町５丁目６８番地 山形金庫ビル６階,,https://office-sasahara.com/contact.html
行政書士法人ウエダ事務所,http://ueda-jimusho.jp,神奈川県横浜市泉区緑園3-25-9,,https://www.ueda-jimusho.jp/contact
行政書士 北浜合同事務所,http://www.kitahama-godo.com,大阪府大阪市中央区久太郎町1-6-15　特織会館102,,https://www.kitahama-godo.com/%E3%81%8A%E5%95%8F%E3%81%84%E5%90%88%E3%82%8F%E3%81%9B/
行政書士川本法務事務所,http://office-kawamoto.com/,神奈川県川崎市中原区上小田中５−５−６　イーストヒルズ弐番館３階事務所,,https://office-kawamoto.com/contact.html
神戸相続サポートセンター,http://www.kobe-souzoku.com/,兵庫県神戸市中央区江戸町８５－１,,https://www.kobe-souzoku.com/contact/
こだち行政書士事務所,https://www.k-gyousei.net/,栃木県鹿沼市栄町１丁目２番１号 グリーンベイビル２０２,,https://www.k-gyousei.net/%E3%81%8A%E5%95%8F%E3%81%84%E5%90%88%E3%82%8F%E3%81%9B/
グリーン司法書士法人・行政書士事務所,http://green-osaka.com/,大阪府大阪市中央区高麗橋四丁目５番２号高麗橋ウエストビル２階,,https://green-osaka.com/contacts/
坂川達志税理士・社会保険労務士・行政書士事務所,https://www.ikg.jp/,山形県新庄市鉄砲町9-17,,https://www.ikg.jp/contact/index.html
いらみな司法書士事務所,http://i-o-office.com/,沖縄県那覇市樋川1-1-68 2階,,https://i-o-office.com/contact.html
佐竹行政書士事務所,http://sg-office.biz/,岐阜県岐阜市細畑塚浦65-5グリーンパーク細畑102,,https://sg-office.biz/mailformpro320/contact_form.html
司法書士法人永田事務所/行政書士永田妙子事務所,http://nagata-souzoku.jp/,岡山県倉敷市白楽町２４９番地５　倉敷商工会館４階,,https://nagata-souzoku.jp/contact
松川行政書士事務所,https://www.office-matsukawa.com/,熊本県熊本市中央区八王寺町１４－４ ＭビルⅡ２０２,,https://www.office-matsukawa.com/%E3%81%8A%E5%95%8F%E3%81%84%E5%90%88%E3%82%8F%E3%81%9B/
OMI税理士法人,https://setsuritsu-zeirishi.com/,滋賀県大津市梅林1-4-1 プレシャスビル2F,,https://setsuritsu-zeirishi.com/contact.html
はぎもと行政書士事務所,http://www.hagimoto-office.com/inshoku,千葉県浦安市東野2-30-22,,https://www.hagimoto-office.com/contact.html
神山行政書士事務所,http://gyosei-syoshi.org/,岩手県奥州市水沢区字桜屋敷36番地1　3号,,http://gyosei-syoshi.org//inquiry
行政書士うめだ法務事務所,https://intl.umedajimusyo.com/,福岡県朝倉市甘木2020‐5,,https://intl.umedajimusyo.com/contact/
K国際行政書士法務事務所,https://www.k-immigration-lawyer.com/,神奈川県横浜市鶴見区鶴見中央1-19-5  新栄ビル403,,https://www.k-immigration-lawyer.com/%E3%81%8A%E5%95%8F%E3%81%84%E5%90%88%E3%82%8F%E3%81%9B/
行政書士吉田茂和事務所,https://www.shigekazu-yoshida.com/,福井県福井市真木町18-21,,https://www.shigekazu-yoshida.com/contact.php
行政書士法人GOAL,http://go-al.co.jp/,東京都中央区銀座1丁目15-7 マック銀座ビル402,,https://go-al.co.jp/contact/
行政書士 菊地法務事務所,https://office-yoshihito.com/,札幌市西区二十四軒4条5丁目12番8-308号,,https://office-yoshihito.com/index.php?%E3%81%8A%E5%95%8F%E3%81%84%E5%90%88%E3%82%8F%E3%81%9B
あおば行政法務事務所,https://aobajim.com/,神奈川県横浜市青葉区市ケ尾町１１５３－３　第２カブラギビル６０６,,https://aobajim.com/contact/
日本橋行政書士あおき法務事務所,https://www.gyosei-aoki.com/,東京都中央区日本橋本町４-６-１０　サトービル５階　ソフィエ日本橋,,https://www.gyosei-aoki.com/%E3%81%8A%E5%95%8F%E3%81%84%E5%90%88%E3%82%8F%E3%81%9B-2/
行政書士横山国際法務事務所,http://lawoffice-yokoyama.com/,東京都中央区日本橋茅場町1-10-6 マツモトビルディング2階,,https://lawoffice-yokoyama.com/inquiry/
鈴木圭介税理士・行政書士事務所,https://www.samurai946.com/,北海道釧路市春採3丁目1番20号,,https://www.samurai946.com/form/samurai946com/inquiry
税理士法人トップマネジメント釧路事務所・甲賀伸彦行政書士事務所,https://www.ninja.ac/,北海道釧路市城山1丁目10番15号 NINJAビル,,https://www.ninja.ac/form/ninjaac/inquiry
くにや司法書士法人,https://www.kuniya.biz/,北海道函館市堀川町6番15号,,https://www.kuniya.biz/mailformpro4/contacts.html
行政書士志水法務事務所,https://www.shimizu-gyosei.com/,桜丘町4-17 PAAP603,,https://www.shimizu-gyosei.com/contact/,請求.*させていただ,１　当事務所の保有個人データに関して、ご本人様から開示の請求があった場合は、確認をさせていただいたうえで、原則として適切な期間内に書面にて開示いたします。