会社名,サービスURL,住所,電話番号,お問い合わせURL
中野行政書士事務所,https://nakano-gyoseishoshi.com/,東京都大田区西蒲田8-24-1 ミマツビル4F,,https://nakano-gyoseishoshi.com/contact/
行政書士事務所アジア経営革新等支援機関,https://asiasupport.biz/,東京都新宿区西新宿7丁目17-7 廣田ビル402号,,https://asiasupport.biz/contact/
行政書士三浦一朗事務所,https://miurai-gyouseioffice.com/,鳥取県西伯郡南部町鴨部1598-1,,https://miurai-gyouseioffice.com/#contact-txt
行政書士事務所ロータス,https://office-lotus.com/,櫛引町2－162　NYビル１階,,https://office-lotus.com/inquiry
宗岡行政書士事務所,http://www.office-muneoka.com/index.html,東京都豊島区南池袋2-29-12　ＨＦ池袋ビルディング6F,,https://www.office-muneoka.com/contact.html
松本行政書士事務所,http://gyosei.officematsumoto.net/index.php?FrontPage,東京都杉並区高円寺南４－２３－１,,https://gyosei.officematsumoto.net/index.php?%E3%81%8A%E5%95%8F%E5%90%88%E3%81%9B
駒沢公園行政書士事務所,https://ootsuka-houmu.com/,東京都大田区上池台1-34-2,,https://ootsuka-houmu.com/contact-2/
エールZEAL国際行政書士事務所,http://yellzeal.com/,埼玉県比企郡滑川町大字羽尾3874番地１,,https://yellzeal.com/contact-us/
行政書士新宿総合法務事務所,https://shinjuku-lawyers.com/,東京都新宿区西新宿７－１１－１５　ミヤコビル３０５,,https://shinjuku-lawyers.com/contact/
行政書士さかもと綜合事務所,https://legal-skmt.com/,大阪府大阪市中央区本町橋２-２３ 第7松屋ビル3階,,https://legal-skmt.com/contact/
行政書士法人畠山事務所,https://www.hatakeyama-office.co.jp/,千葉県千葉市千城台西1丁目34番10号,,https://www.hatakeyama-office.co.jp/contact.html
行政書士事務所Link-Up,https://www.kitagawa-office.jp/,神奈川県茅ヶ崎市南湖5−6−1第二南湖ビル201,,https://www.kitagawa-office.jp/%E3%81%8A%E5%95%8F%E3%81%84%E5%90%88%E3%82%8F%E3%81%9B/
島岡和雄行政書士事務所,https://shimaoka-office.com/,埼玉県さいたま市大久保領家458番地8,,https://shimaoka-office.com/#contact
さくらい行政書士事務所,https://www.sakurai-gyouseisyoshi.com/,千葉県佐倉市山王2-11-6,,https://www.sakurai-gyouseisyoshi.com/%E3%81%8A%E5%95%8F%E3%81%84%E5%90%88%E3%82%8F%E3%81%9B/
ハピネス行政書士事務所,https://www.sugawara4976.com/,東京都江戸川区西葛西6-13-12　第一大高ビル5F,,https://www.sugawara4976.com/inquiry/
行政書士事務所ＲＥＡL,https://real.or.jp/,埼玉県上尾市大字平塚3115-6,,https://real.or.jp/contact/
行政書士佐藤千秋事務所,https://sato-office.com/,千葉県佐倉市千成三丁目30番9号,,https://sato-office.com/contact/
大村行政書士事務所,http://omuraoffice.jp/,東京都新宿区西新宿1-25-1 新宿センタービル49階,,https://omuraoffice.jp/html/main/contact.html
行政書士法人エベレスト,http://www.gyouseishoshi-everest.com/,愛知県名古屋市中村区名駅五丁目3番6号 神谷ビル6階,,https://www.gyouseishoshi-everest.com/contact-us/
ワークスハブ行政書士事務所,https://works-hub.jp/,東京都江戸川区鹿骨2-32-12,,https://works-hub.jp/contact-form/
巣鴨地蔵行政書士事務所,https://sugamojizo.com/,東京都豊島区巣鴨4-22-26 光マンション202,,https://sugamojizo.com/contact/
竹田紘己行政書士事務所,https://www.takedagyousei.com/,東京都北区赤羽西1-39-8コーポ遠山201,,https://www.takedagyousei.com/contact
鎌倉小町行政書士事務所,https://tsunekioffice.com/,小町1-9-3島森ビル3階,,https://tsunekioffice.com/%e3%81%8a%e5%95%8f%e5%90%88%e3%81%9b/
浅井行政書士事務所,https://asaioffice.com/,鶴屋町2-27-7ピュアハイツ台町307,,https://asaioffice.com/contact/
行政書士野崎明穂事務所,https://nozaki-gyousei-office.com/,埼玉県川口市東川口１丁目15－4,,https://nozaki-gyousei-office.com/contact/
あいきょう行政書士事務所,https://aikyo-gyosei.jp/,千葉県船橋市東船橋４丁目３０番地８号サンビレッジ２０７号室,,https://aikyo-gyosei.jp/inquiry/
まつど行政書士事務所,https://matsudo-office.jp/,千葉県松戸市根本452 篠崎建物305号,,https://matsudo-office.jp/contact
いろは行政書士事務所,https://www.irohagyosei.jp/,千葉県松戸市五香1丁目12ｰ10,,http://www.irohagyosei.jp/contact/
サポート行政書士法人,https://www.shigyo.co.jp,東京都新宿区西新宿2-3-1 新宿モノリスビル2F,,https://www.shigyo.co.jp/contact_us/
沼田裕子行政書士事務所,https://numatanet.com/,埼玉県越谷市北越谷2丁目21番10号,,https://numatanet.com/contact.php
稲田堤行政書士事務所,https://www.office-inadazutsumi.com/index.html,神奈川県川崎市菅稲田堤1-3-25レジデンス稲田堤301,,https://www.office-inadazutsumi.com/contact.html
下川原行政書士事務所,http://www.shimokawara-office.com/,神奈川県座間市相模が丘1-36-55 クリオ小田急相模原弐番館109号室,,https://www.shimokawara-office.com/contact
株式会社シンセシスリーガルファミリア　望月綜合法務事務所グループ,http://gift-m.com/,大阪市北区南森町1丁目3番29号,,https://gift-m.com/contact/
行政書士金子里見事務所,http://kanejim.com,秋田県秋田市将軍野東二丁目22番56号,,https://kanejim.com/contact.html
後藤行政書士事務所,https://www.gotoh-gyoseishoshi.jp/,埼玉県越谷市越ヶ谷一丁目３番１４号文省堂ビル５階,,https://www.gotoh-gyoseishoshi.jp/contact.html
行政書士法人スマートサイド,https://www.shinjuku-kensetsu.jp/,東京都文京区小石川1-3-23　ル・ビジュ-601,,https://www.shinjuku-kensetsu.jp/contact
行政書士ひるかわ事務所,http://hirukawa-office.com/,神奈川県横浜市原宿3-14-14-A,,https://www.hirukawa-office.com/#contact
行政書士法人クリムゾンパートナーズ札幌,https://www.crimson-sapporo.com/,北海道札幌市中央区南一条東２丁目１１－１　ノーザンヒルズ大通東９階,,https://www.crimson-sapporo.com/contact
アンド・ワン司法書士行政書士事務所,https://andone-ueki.jp/,東京都中央区銀座1丁目20番14号　KDX銀座一丁目ビル 1階,,https://andone-ueki.jp/contact
WINDS行政書士事務所,https://www.windsgyosei.com/,東京都新宿区西新宿7－17－14　 新宿シティ源ビル,,https://www.windsgyosei.com/contact/
谷島行政書士事務所,https://tanishima.net/,東京都港区六本木2-4-9アソルティ六本木1丁目1階,,https://tanishima.net/%e3%81%8a%e5%95%8f%e5%90%88%e3%81%9b/
JAPAN行政書士事務所,https://japan-sk.com/,東京都台東区東上野三丁目１７番８号　大野屋ビル３階A号室,,https://japan-sk.com/contact/
吉岡俊二行政書士事務所,http://www.g-yoshioka.jp/,日本橋人形町2-7-5-1405,,https://www.g-yoshioka.jp/contact/
せとうち行政書士事務所,https://setouchigyousei.com/,東京都大田区山王2-5-6 山王ブリッジ5階45号室,,https://setouchigyousei.com/contact/
行政書士平成国際法務事務所,https://www.heiseikokusai.com/,東京都渋谷区千駄ヶ谷5丁目21番8号 代々木第10下田ビル9階,,https://www.heiseikokusai.com/%E3%81%8A%E5%95%8F%E3%81%84%E5%90%88%E3%82%8F%E3%81%9B/
大門行政書士事務所,http://officedaimon.com/index.html,東京都中野区上鷺宮２－４－１－１３０３,,https://officedaimon.com/contact.html
ユニ行政書士法務事務所,https://office-uni.com/,神奈川県平塚市袖ヶ浜 1-12-1,,https://office-uni.com/contact/
北川行政書士法務事務所,https://kitagawa-office.com/,神奈川県横浜市保土ケ谷区権太坂1-41-6,,https://kitagawa-office.com/contact/
行政書士法人 オーシャン,https://www.ocean.jpn.com/,神奈川県横浜市高島2丁目14-17 クレアトール横浜ビル５階,,https://www.ocean.jpn.com/contact/
オリ行政書士事務所,https://oli-gyosei-shien.com/,蒲生南町24-36-209,,https://oli-gyosei-shien.com/contact/
小笠原薫子行政書士事務所,https://ogasawara-accounting.com/,金明町446-8,,https://ogasawara-accounting.com/contact
服部俊明行政書士事務所,https://office-hattori.net/,日進町3丁目99番地1　ライオンズガーデン大宮日進402号室,,https://office-hattori.net/contact/
ところさわ行政書士事務所,https://kigyou-net.com/,緑町3-29-9ヒルズ緑町201,,https://kigyou-net.com/contact.html
OBI行政書士事務所,https://obi-office.com/,埼玉県さいたま市本太3丁目13番地15号 303,,https://obi-office.com/contact/
行政書士アンフィニ法務事務所,https://office-infini-h.com/,埼玉県所沢市西所沢1丁目10番11号ビルズ吉祥西所沢駅前201号,,https://office-infini-h.com/contact
飯塚行政書士事務所,https://gyousei1.jp/,高砂２－８－４市川ビル４階,,https://gyousei1.jp/contact/
行政書士法人中央合同事務所,http://www.nouten.jp/,千葉県千葉市中央4丁目12−9 1F,,https://www.nouten.jp/contact.php
行政書士法人サークレスト,https://circlest.co.jp/,西馬橋幸町132-3-2F,,https://circlest.co.jp/#contact
いそご法務小竹行政書士事務所,https://www.kotake.net/,東町15-32 モンビル503,,https://www.kotake.net/contact/
みなも行政書士事務所,https://www.minamojimusyo.net/index.html,三番町20番地2 三番町パークライフ503号,,https://www.minamojimusyo.net/contact.html
行政書士武藤事務所,https://gyouseishoshi-muto.com/index.html,神奈川県茅ヶ崎市高田4-21-51,,https://gyouseishoshi-muto.com/contact.html
行政書士丸山理事務所,https://gyousei-maruyama-office.com/,神奈川県横浜市保土ケ谷区初音ヶ丘26-18,,https://gyousei-maruyama-office.com/contact/
C. S. AND P. 行政書士事務所,https://workingvisa.csap.tokyo/,永田町2－17－17 AIOS永田町 2F,,https://workingvisa.csap.tokyo/contact/
司法書士行政書士 日暮里上野法務事務所,https://www.s-shihoushoshi.com/,東京都荒川区東日暮里５－５２－２神谷ビル４０６,,https://www.s-shihoushoshi.com/%E3%81%8A%E5%95%8F%E5%90%88%E3%81%9B/#anchorMailform
行政書士小出事務所,http://koide-office.com/index.html,山下町73山下ポートハイツ701,,https://koide-office.com/contact/index.html
増村行政書士事務所,https://m-kensetsu.com/,東京都台東区三筋1-9-4　中央クレセントビル2階,,https://m-kensetsu.com/contact.html
田口行政書士事務所,https://jetgyousyo.com/,東京都豊島区南大塚2丁目35-3　鴨志田ビル　5階,,https://jetgyousyo.com/contact
ムーブ行政書士事務所,https://office-kmb.com/,本町３丁目２４－２ニュー本町ビル5階C号室,,https://office-kmb.com/contact
行政書士入学事務所,https://newgaku.net/,神奈川県秦野市渋沢三丁目１番１号,,https://newgaku.net/contact
大戸行政書士事務所,https://www.ototoshikatsu.com/,神奈川県相模原市相生1-11-8 ＭＢＣ第二ビル,,https://www.ototoshikatsu.com/contact/
戸田行政書士事務所,https://todagyosei.jimdofree.com/,豊野町１丁目１８−２７,,https://todagyosei.jimdofree.com/%E3%81%8A%E5%95%8F%E5%90%88%E3%81%9B/
深佐行政書士事務所,https://fukasa.com/,埼玉県北足立郡伊奈町寿2-149,,https://fukasa.com/%E3%81%8A%E5%95%8F%E5%90%88%E3%81%9B/
OTB行政書士事務所,https://otb-goffice.com/,埼玉県熊谷市弥生２丁目42番３ 大久保ビル３号室,,https://otb-goffice.com/contact/
CTC行政書士法人,https://www.ctc-cc.jp/,本町6-4-23　船橋ケイウッドビル703,,https://www.ctc-cc.jp/office/contact/
トーク行政書士法人,https://talk-group.co.jp/,千葉県千葉市若葉区都賀3-9-1,,https://talk-group.co.jp/contact/
司法書士・行政書士ベル総合事務所,https://bell-souzoku.com/,東京都千代田区九段南二丁目２番３号 九段プラザビル８階,,https://bell-souzoku.com/contact
スタートライン行政書士事務所,https://st-line-isansouzokusoudan.jp/,東京都港区三田2-14-5　フロイントゥ三田904号,,https://st-line-isansouzokusoudan.jp/contact/
佐野社会保険労務士・行政書士事務所,http://sano-syaroshi.com/,東京都渋谷区渋谷2-7-13大一ビル2C,,http://sano-syaroshi.com/html/contact/index.html
大田行政書士事務所,http://www.ohta-gyosei.jp/,神奈川県横浜市梅が丘21-12アベニュー21-303号室,,https://www.ohta-gyosei.jp/contact/
行政書士伊藤智子事務所,https://www.itotomoko-office.com/,上鶴間本町2丁目25番20-801号,,https://www.itotomoko-office.com/contact/
横田行政書士事務所,https://k-yokota.com/index.php?FrontPage,神奈川県座間市入谷東4丁目15-14,,https://k-yokota.com/index.php?%E3%81%8A%E5%95%8F%E3%81%84%E5%90%88%E3%82%8F%E3%81%9B
かやはら行政書士事務所,https://kayaharajimusyo.com/,埼玉県春日部市牛島９４－８,,https://kayaharajimusyo.com/contact.html
行政書士法人マイリーガル,https://mylegal.jp/,埼玉県東松山市大字上唐子1418番地3,,https://mylegal.jp/info/contact.html
行政書士星山信明事務所,https://mtstar-gs.com/,埼玉県行田市持田2240-23,,https://mtstar-gs.com/contact/
行政書士法人タッチ,https://touch.or.jp/,宮町一丁目86番地1大宮イーストビル5階,,https://touch.or.jp/inquiry/
まさひろ行政書士事務所,https://office-masahiro.com/,千葉県佐倉市染井野７－７－２,,https://office-masahiro.com/contact_here
千葉サポート行政書士事務所,https://tanaka-office.net/,栄町36番10号甲南アセット千葉中央ビル6F2,,https://tanaka-office.net/contact7.html
すがわら行政書士事務所,https://sugawara-gs.com/,千葉県船橋市高野台3-23-8ダウンタウン323-101号,,https://sugawara-gs.com/contact
行政書士わたなべ相続相談室,https://chiba-souzokusoudan.com/,栄町36-10甲南アセット千葉中央ビル9F,,https://chiba-souzokusoudan.com/contact/
Amie国際行政書士事務所,https://amie-visa.com/,千葉県千葉市稲毛区小仲台1-5-26,,https://amie-visa.com/contact/
株式会社ウェイビー,http://www.wavy-kigyou.com,東京都渋谷区代々木１丁目３６−４ 全理連ビル 5階,,https://www.wavy-kigyou.com/contact/
行政書士法人あさひ法務,http://www.asahihoumu.com/,千葉県柏市柏4丁目5番10号サンプラザビル2階,,https://www.asahihoumu.com/contact/
行政書士法人内田総合事務所,https://www.uchidajimusyo.or.jp/,千葉県千葉市新港203,,https://www.uchidajimusyo.or.jp/contact.html
服部行政書士事務所,http://www.hattori-office.jp/,東京都千代田区岩本町3-2-2　マルトモ東京ビル2階,,https://www.hattori-office.jp/contact
行政書士柴田法務会計事務所,https://www.yuigonsyo.biz/,東京都板橋区大谷口2-24-13,,https://www.yuigonsyo.biz/contact/
行政書士三雲法務事務所,http://www.mikumo-houmu.com/,東京都港区高輪二丁目１４番１４号高輪グランドハイツ８０１,,https://www.mikumo-houmu.com/contact
行政書士藤野法務事務所,https://f-suguru.com/,公田町931-126,,https://f-suguru.com/contact.html
行政書士渡辺事務所,https://www.souzoku-watanabe.jp/,埼玉県さいたま市下落合5-10-5 アステリVIP228,,https://www.souzoku-watanabe.jp/contact
アキ・オフィス,https://www.aki-office.com/,埼玉県さいたま市針ヶ谷4-7-33,,https://www.aki-office.com/contact/
ものえ行政書士事務所,http://monoe.biz/,宮崎町235-1,,https://monoe.biz/contact/
にしざわ行政書士事務所,http://nishizawa-office.biz/,千葉県千葉市東千葉1-3-2-404,,https://nishizawa-office.biz/contact.html
松戸パートナー行政書士事務所,https://matsudo-partner.jimdofree.com/,千葉県松戸市小根本91-1-308,,https://matsudo-partner.jimdofree.com/%E3%81%8A%E5%95%8F%E3%81%84%E5%90%88%E3%82%8F%E3%81%9B/
中曽根ゆかり行政書士事務所・社会保険労務士事務所,https://nakasone-office2021.com/,千葉県柏市柏3-3-3フォレストかしわ２０１号,,https://nakasone-office2021.com/contact/
和田行政書士事務所,http://kaishahojin.com,大分県別府市上野口町2番37号,,https://kaishahojin.com/contact/
木村行政書士事務所,https://kimura-gyouseishosi.com/,神奈川県茅ヶ崎市共恵１−５−２８−２０３,,https://kimura-gyouseishosi.com/contact/
あいりん行政書士事務所,https://souzoku-yokohama.net/,神奈川県横浜市神奈川区鶴屋町2-12-1 カリオカビル2階,,https://souzoku-yokohama.net/contact
株式会社プランベース,https://planbase.co.jp/,東京都新宿区揚場町2番18号 ブリエ飯田橋4F,,https://planbase.co.jp/contact/
大阪うぐいす行政書士事務所,https://osaka-uguisu.com/,淡路町1丁目3番6号 日宝淡路町ビル3階5号,,https://osaka-uguisu.com/contact/
株式会社事業パートナー九州,https://jigyo-partner.com/,北九州市戸畑区浅生１丁目３－３,,https://jigyo-partner.com/contact/
グッドラック行政書士事務所,https://office-inobe.com/,田の湯町3番7号 アライアンスタワーZ6階1号室,,https://office-inobe.com/contact/
エバーラスティング株式会社,https://everlasting-japan.co.jp/,〒590-0943 大阪府堺市堺区車之町東1-1-2 井上ビル202,,https://everlasting-japan.co.jp/contact
スタートアップ行政書士事務所,https://start-up22.com/,愛知県あま市森6丁目9－7,,https://start-up22.com/contact/
Man to Man株式会社,https://www.man-to-man-g.com/landing_pages/online/,愛知県名古屋市中区新栄1丁目7番7号RTセンターステージビル,,https://www.man-to-man-g.com/contact-us/
ソック株式会社,https://wallenge.co.jp/index.html#link2,山形県長井市栄町10番1号,,https://wallenge.co.jp/contact/
行政書士法人アイサポート総合法務事務所,http://www.ai-support.biz,末広町4番1号　鈴木ビル5階,,https://www.ai-support.biz/contact/
米井行政書士事務所,http://yonei-office.com,東京都墨田区東向島3-10-9-403,,https://www.yonei-office.com/contact
行政書士法人アッパーリンク,http://hassin.net,広島県広島市西区観音新町2丁目4番25号,,https://hassin.net/inquiry/
行政書士井原総合法務事務所,http://www.office-ihara.com,兵庫県神戸市中央区元町通4丁目6番21号　ジュネスビル3-2号室,,https://www.office-ihara.com/contact.html
はなみずき司法書士事務所,http://www.8732ki.com,愛知県長久手市杁ヶ池106番地2　1階,,https://www.8732ki.com/contact/
アイビー行政書士事務所,http://www.ivy-g.com,埼玉県日高市下鹿山502-15,,https://www.ivy-g.com/sogo-contact.html
尾上拓郎行政書士事務所,http://onoue-gyousei.com,福岡県福岡市博多区美野島１-１３-１１,,https://onoue-gyousei.com/inquiry/
行政書士塩永健太郎事務所,http://shionagaoffice.jp/,熊本県熊本市中央区水前寺１丁目9番6号,,https://shionagaoffice.jp/contact/
かけい行政書士事務所,http://www.kakei-office.com,神奈川県川崎市幸区下平間204 倉田ビル301,,https://www.kakei-office.com/contact
山田博和行政書士事務所,http://kaiketsu-yamada.com,東京都足立区本木南町3-15,,https://kaiketsu-yamada.com/%e3%81%8a%e5%95%8f%e3%81%84%e5%90%88%e3%82%8f%e3%81%9b/
行政書士法人きずな徳島,http://www.gyousei-naruto.net,徳島県板野郡藍住町勝瑞字成長54番地2,,https://www.gyousei-naruto.net/contact
行政書士　磯野法務事務所,http://www.isono-houmu.jimusho.jp,茨城県水戸市東桜川1-29,,https://www.isono-houmu.jimusho.jp/contactform2.html
エフォート行政書士事務所,http://effort-office.net,滋賀県大津市赤尾町4番24号,,https://effort-office.net/contact/
平島国際行政書士事務所,http://www.hirashima-igs.com,東京都豊島区東池袋1-39-15 シャトレー東池袋8階 805,,https://www.hirashima-igs.com/contact.html
愛テラス法務事務所,http://aiterasu.com,新潟県新潟市西区小針6丁目6-6,,https://aiterasu.com/contact-me/
シーサイド行政書士法人,http://seaside-agency.com/index.html,神奈川県横浜市金沢区富岡東 2-1-32-1006,,https://seaside-agency.com/contact/index.cgi
悠里司法書士・行政書士事務所,http://www.shihou-syoshi.net/,大阪府大阪市福島区海老江5丁目2-２大拓ビル７F,,https://www.shihou-syoshi.net/inquiry/
行政書士篠原たかゆき事務所,http://selfemployed.jp,富山県高岡市明園町9-30,,https://selfemployed.jp/index.php?%E3%81%8A%E5%95%8F%E5%90%88%E3%81%9B
岩井優税理士事務所,http://www.zeikaikei.com,神奈川県横浜市中区不老町1-6-9　第一HBビル3F,,https://www.zeikaikei.com/contact.html
行政書士みやこ事務所,http://www.miyako-office.net,京都府京都市上京区千本中立売西入四番町122番地1 ディオ・フェルティ北野東402号,,https://www.miyako-office.net/inquiry/
社会保険労務士・行政書士蔭山行伸事務所,http://www.kageyama-sr.com,神奈川県横浜市大岡1-59-3,,https://www.kageyama-sr.com/contact/
毛見会計事務所,http://www.kemikaikei.com,群馬県前橋市下石倉町20番地5,,https://www.kemikaikei.com/contact/
株式会社イズミ経営,http://izumikeiei.com,大阪府大阪市中央区瓦町1-4-6　市岡宏産ビル7階,,https://izumikeiei.com/contact/
行政書士なかじま事務所,http://www.llc-b.com,兵庫県西宮市馬場町4-4いすず西宮ビル3F,,https://www.llc-b.com/contact/
川口市民法務事務所,http://www.touki-mitsumori.com/,埼玉県川口市並木2-37-2,,https://www.touki-mitsumori.com/mail_01/contact.html
gsoj行政書士大島法務事務所,http://officeooshima.web.fc2.com,京都府京都市中京区西ノ京東月光町4番地26,,https://officeooshima.web.fc2.com/inquiry/index.html
行政書士宮田知章事務所,http://miyata-legal.com,東京都豊島区目白2丁目3番18号 目白レジデンス3０5,,https://miyata-legal.com/contact.html
行政書士高橋幸也うめさと駅前事務所,http://www.umesato-office.com,千葉県野田市山崎1861-1ルネサンス梅郷駅前302,,https://www.umesato-office.com/contact.html
横尾行政書士事務所,http://www.e-gyosei.com,東京都板橋区板橋1-46-2シャロン新板橋603,,https://www.e-gyosei.com/%E3%81%8A%E5%95%8F%E3%81%84%E5%90%88%E3%82%8F%E3%81%9B/
行政書士山田経営法務事務所,http://www.kabushiki-co.com,東京都多摩市南野3-7-26,,https://www.kabushiki-co.com/contact-ask/index.html
行政書士ハーツ事務所,http://2hearts.sakura.ne.jp,東京都立川市錦町1-5-25第3丸岩ビル2F,,https://2hearts.sakura.ne.jp/contactus.html
友貴総合法務事務所,http://yuki-legal.com/index.html,埼玉県坂戸市関間4-4-39ライオンズガーデン若葉604,,https://yuki-legal.com/#contact
アイリス行政書士法人,http://www.iris-gyosei.com,大阪府大阪市淀川区西中島5丁目13番24号アンシャンテ新大阪503号,,https://www.iris-gyosei.com/contact/
行政書士三浦事務所,http://www.miura2580.jp,埼玉県坂戸市南町24-5長久保ビル202,,https://www.miura2580.jp/contact/
青木行政書士事務所,http://n-aokioffice.com,愛媛県松山市森松町1068番地ビッグウエスト105号,,https://n-aokioffice.com/contact/
行政書士　影浦法務事務所,http://kg-lo.jp,大阪府大阪市中央区瓦町3-4-10　日宝御堂ビル4F,,https://kg-lo.jp/index.php/contactus/
行政書士雨堤孝一事務所,http://amazutsumi.jp,大阪府大阪市北区梅田1-1-3大阪駅前第三ビル12階1号室,,http://amazutsumi.jp/contact.html
みつおか行政書士事務所,http://www.mitsuoka-gyousei.com,兵庫県川西市清和台西5丁目4-99,,https://www.mitsuoka-gyousei.com/contact
井戸行政書士法務事務所,http://www.idojimu.jp,愛知県一宮市浅野大西59-1,,https://www.idojimu.jp/inquiry/
行政書士ＯＦＦＩＣＥノムラ,http://www.office-n.bz,兵庫県尼崎市東園田町9丁目８−９Ｒｏｏｔｓビル２Ｆ,,https://www.office-n.bz/contact.html
行政書士三田寺大輔事務所,http://www.office-mitadera.com,茨城県土浦市小松三丁目24番26号,,https://www.office-mitadera.com/contact-html/
行政書士　堀総合法務事務所,http://office-hori.com,京都府長岡京市滝ノ町１丁目３番１４号　１階,,https://office-hori.com/contact/
OKUMURA OFFICE　行政書士 奥村泰久事務所,http://okumura-office.net,東京都荒川区荒川６−３−２,,https://okumura-office.net/contact/
井田ゆみこ行政書士事務所,http://www.ida-yumiko.com,千葉県習志野市大久保2−14−5−408,,https://www.ida-yumiko.com/contact/index.html
国際行政書士事務所アウィリーズ,http://www.officeawi.com,大阪府大阪市城東区新喜多1-1-18　京橋辰田ビル4B,,https://www.officeawi.com/contact
竹中行政書士事務所,http://takenaka-eiken.com,大阪府八尾市竹渕西4-238-7,,https://takenaka-eiken.com/%e3%81%8a%e5%95%8f%e3%81%84%e5%90%88%e3%82%8f%e3%81%9b/
中田典子行政書士事務所,http://www.nakatagyousei.com,奈良県大和郡山市小泉町２１０４-１６,,https://www.nakatagyousei.com/%e3%81%94%e7%9b%b8%e8%ab%87%e3%83%bb%e3%81%8a%e5%95%8f%e5%90%88%e3%81%9b-2/
東梅田行政書士法務会計事務所,http://www.iteya-office.com,大阪府大阪市北区中崎1-2-6　エスリード東梅田603,,https://www.iteya-office.com/inquire/contact.html
行政書士いしがみ事務所,http://www.office-ishigami.com,東京都江戸川区篠崎町5-1-3,,https://www.office-ishigami.com/index.php?%E7%84%A1%E6%96%99%E7%9B%B8%E8%AB%87%EF%BC%86%E3%81%8A%E5%95%8F%E3%81%84%E5%90%88%E3%82%8F%E3%81%9B
