会社名,サービスURL,住所,電話番号,お問い合わせURL
山寺行政書士事務所,http://y-gyousei.com,神奈川県川崎市高津区諏訪１−７−２,,https://y-gyousei.com/%E3%81%8A%E5%95%8F%E3%81%84%E5%90%88%E3%82%8F%E3%81%9B
イトウ行政書士法務事務所,http://www.jigyousei.com,千葉県山武郡芝山町小池2491番地4,,http://www.jigyousei.com/index.php?%E3%81%8A%E5%95%8F%E3%81%84%E5%90%88%E3%82%8F%E3%81%9B%E3%83%BB%E3%81%94%E7%9B%B8%E8%AB%87
井筒行政書士事務所,http://office-izutsu.com,兵庫県明石市硯町３丁目６番３８号,,https://office-izutsu.com/contact/
みしま社会保険労務士行政書士事務所,http://www.office-mishima.com/data/joseikin.html,大阪府大阪市中央区徳井町2-2-2  テツタニビル407号,,https://www.office-mishima.com/contact/
松井行政書士事務所,http://matsui-g-office.com,奈良県奈良市中山泉ヶ丘200番地の111,,https://matsui-g-office.com/index.php?%E3%81%8A%E5%95%8F%E3%81%84%E5%90%88%E3%82%8F%E3%81%9B
ミウラ行政書士事務所,http://www.teikan-consul.com,神奈川県横浜市西区戸部本町16番4号301,,https://www.teikan-consul.com/contact/
山崎行政書士事務所,http://gyouseishoshi.fast-hp.com,千葉県我孫子市我孫子2丁目6番935号,,https://gyouseishoshi.fast-hp.com/contact.php
ライフ・リーガル松中　良行政書士事務所,http://www.life-legal.com,愛媛県新居浜市坂井町1丁目７番38号,,https://www.life-legal.com/contact
井上勇夫税理士事務所,http://www.inoue13tax.com,奈良県生駒市谷田町870-2 中谷ビル503,,https://www.inoue13tax.com/contact.html
松島行政書士事務所,http://www.matsu-gyosei.com,埼玉県志木市中宗岡2-7-50,,https://www.matsu-gyosei.com/contact
いけもと行政書士事務所,http://ikemoto-office.biz,千葉県印旛郡酒々井町　東酒々井1-1-133-101,,https://ikemoto-office.biz/contact.php
行政書士大藤法務事務所 大藤社会福祉士事務所,http://office-ohfuji.com,千葉県成田市中台6-14-6,,https://office-ohfuji.com/contact/
荒木行政書士事務所,http://www.gyouseishoshi-araki.com,千葉県千葉市中央区新千葉3-2-1 新千葉プラザマンション505号室,,https://www.gyouseishoshi-araki.com/contact
行政書士河田悟事務所,http://gyouseisyosi.main.jp/index.php,新潟県長岡市蔵王1-1-31　ダイアパレス長岡蔵王305号,,https://gyouseisyosi.main.jp/index.php?%E3%81%8A%E5%95%8F%E3%81%84%E5%90%88%E3%82%8F%E3%81%9B
ＫＬＥＥ行政書士事務所,http://klee-gyousei.com,東京都港区新橋6-5-5　新生ビル２Ｆ,,https://klee-gyousei.com/inquiry/
行政書士クアルテート事務所,http://cuarteto.jp,東京都東村山市秋津町4−37−17,,https://cuarteto.jp/contact/contact_02.html
株式会社レバレッジ,http://www.sigyo.net/list/archives/gyouseisyoshi-horiuchi-masayuki.html,東京都港区芝2-12-13 ASITIS芝4F,,https://www.sigyo.net/quick-contact/
フロンティア総合国際法務事務所,http://www.visa-specialist.com,大阪府大阪市北区芝田1丁目4-17梅田エステートビル2F,,https://www.visa-specialist.com/visa-inquiry-form.html
行政書士ましこ事務所,http://syakuyousyo.com,新潟県新発田市東新町2丁目3-28,,https://syakuyousyo.com/contact.html
ランドマーク税理士法人,http://www.zeirisi.co.jp,東京都千代田区丸の内2丁目5番2号三菱ビル9階,,https://www.zeirisi.co.jp/soudan-contact/
行政書士松浦総合法務オフィス,http://www.rikonsos.com,東京都足立区千住3-61-1,,https://www.rikonsos.com/contact/
税理士法人　入江会計事務所,https://irie-office.com/,兵庫県神戸市中央区京町74番地　京町74番ビル 4階,,https://irie-office.com/contact/
しのだ行政書士事務所,http://www.souzoku-madoguchi.com,埼玉県三郷市新和2-292-8,,https://www.souzoku-madoguchi.com/inquiry/
不動産法務サポートオフィス行政書,http://www.fudosanhoumu.com,東京都台東区蔵前四丁目30番7号タイガ-ビル52号室,,https://www.fudosanhoumu.com/contact/
行政書士工藤法務コンサルタント事務所,http://www.office-kudo.com,神奈川県横浜市中区翁町1-4-8Ｚ西村ビル105,,https://www.office-kudo.com/contact
彩行政書士事務所,http://ssaaii.com,神奈川県川崎市中原区井田三舞町6-1-3０3,,https://ssaaii.com/%e5%95%8f%e3%81%84%e5%90%88%e3%82%8f%e3%81%9b/
ヨネツボ北海道おおた行政書士事務所,http://www.oota-office.com,北海道札幌市中央区大通西11丁目4番地21 52山京ビル702号室,,https://www.oota-office.com/contact/
オータ事務所株式会社,http://www.ota.co.jp,東京都新宿区西新宿6-5-1 新宿アイランドタワー22階,,https://www.ota.co.jp/contact/
行政書士・社会保険労務士へんみ事務所,http://www.henmi-adm.jp,宮城県仙台市宮城野区松岡町20-61,,https://www.henmi-adm.jp/contact/
さとがおか行政書士事務所,http://www.gyousei-hp.com/ls/satogaoka2001,福島県いわき市郷ヶ丘2丁目52番地の7,,https://www.gyousei-hp.com/contact/
株式会社ドヰ福祉法務事務所,http://www.doi-office.com,千葉県船橋市薬円台4-1-25　YDビル1F,,https://www.doi-office.com/06contact/form.html
池端事務所,http://www.ikehata-office.jp,千葉県八千代市大和田新田312番地9,,https://www.ikehata-office.jp/inquiry/
行政書士 尼崎,http://www.kasahara-jimusho.com,兵庫県尼崎市武庫元町3丁目25-22,,https://www.kasahara-jimusho.com/contact.html
東京都北区赤羽 吉村行政書士事務所,http://www.gyosyo.jp,東京都北区神谷2-24-1セイワコ-ポ201号,,https://www.gyosyo.jp/contact
行政書士佐藤正巳事務所,http://www.zairyusikaku.jp,東京都千代田区内神田１−５−６エステムプラザ丸の内ノースライズ７０１号,,https://www.zairyusikaku.jp/%e3%81%8a%e5%95%8f%e3%81%84%e5%90%88%e3%82%8f%e3%81%9b/
行政書士 村松哲事務所,http://www.e-shinnsei.com,岩手県紫波郡矢巾町広宮沢第10地割501番地25,,https://www.e-shinnsei.com/contact/
行政書士法人 水戸綜合事務所,http://mitosogo.com,茨城県水戸市大工町1丁目3番地11東陽ビル7階,,https://www.mitosogo.com/contact/
内野行政書士事務所,http://www.uchino.info,東京都板橋区南常盤台2-9-20,,https://www.uchino.info/contact-us
山本行政書士・土地家屋調査士事務所,http://www.yama-office.jp,東京都江東区木場6-9-5山本工業ビル2F,,https://www.yama-office.jp/form/yama-office/contact
シャトー・カンパニー株式会社,http://www.shatow.com,東京都品川区大崎５丁目９−３ラフィネ大崎１０２,,https://www.shatow.com/inquiry/access.html
きたまち綜合事務所,http://www.eigyo-number.com,東京都練馬区北町5-10-17 ノースタウン１階Ｄ,,https://www.eigyo-number.com/contact/
森安公認会計士事務所,http://www.moriyasu-cpa.jp,東京都港区港南2-16-1　品川イーストワンタワー4階,,https://www.moriyasu-cpa.jp/contact-us
資源循環局　一般廃棄物対策課,http://www.med-ss.jp,,,https://www.med-ss.jp/contact/
行政書士法人小関事務所,http://www.ozeki-office.com/,神奈川県小田原市東町５−８−７,,https://www.ozeki-office.com/inquiry/
行政書士宮田事務所,http://www.miyata-gyousei.com,埼玉県比企郡嵐山町菅谷570-1,,https://www.miyata-gyousei.com/contact
吉川和章税理士事務所,http://www.y-ao.net,静岡県静岡市葵区若松町96-16,,https://www.y-ao.net/contact/
行政書士梅澤法務事務所,http://www.umezawa-office.net,山梨県甲府市国母3丁目11番23号,,https://www.umezawa-office.net/contact/
おぐり行政書士事務所,http://souzoku8.com,岐阜県中津川市本町1丁目1番7号　毛糸のオグリ2階,,https://souzoku8.com/contact/
司法書士・行政書士　アシスト合同事務所,http://shoshi.info,大阪府大阪市城東区新喜多1-1-2　京橋岡村ビル2F,,https://shoshi.info/contact/
行政書士秦総合事務所,http://www.tetuduki-shien.com,大阪府岸和田市別所町三丁目１０番４号,,https://www.tetuduki-shien.com/contact.html
行政書士西尾法務事務所,http://e-npo240.com,兵庫県神戸市中央区北長狭通4-2-5 ローレル元町ビル4階,,https://e-npo240.com/contact
社会保険労務士法人牧江＆パートナーズ事務所,http://www.makie-office.com/subsidy/index.html,兵庫県西宮市和上町５番９号　西宮ビル,,https://www.makie-office.com/contact/
行政書士辻法務事務所,http://www.gyosei-tsuji.biz,大阪府大東市寺川５ー１８−７３,,https://www.gyosei-tsuji.biz/#%E3%81%8A%E5%95%8F%E5%90%88%E3%82%8F%E3%81%9B
行政書士法人トライスター法務事務所,http://tri-star.jp/,神奈川県横浜市中区元浜町3-21-2ヘリオス関内ビル1110,,https://tri-star.jp/contact/
石口美子行政書士事務所,http://ishiguchi-office.com,神奈川県相模原市中央区富士見1-5-2,,https://ishiguchi-office.com/%E3%81%8A%E5%95%8F%E3%81%84%E5%90%88%E3%82%8F%E3%81%9B/
行政書士　原　達芳　事務所,http://thara.a.la9.jp,神奈川県川崎市川崎区渡田新町1-2-1,,https://thara.a.la9.jp/contact.html
行政書士小林法務事務所,http://www.kobayashi-houmu.com,神奈川県藤沢市片瀬海岸2丁目9-6 藤ビル401,,https://www.kobayashi-houmu.com/contact.html
税理士法人北村会計,http://www.kitamurakaikei.com,埼玉県さいたま市大宮区堀の内町3-54 北村会計ビル,,https://www.kitamurakaikei.com/contact.html
山口社会保険労務士・行政書士オフィス,http://www.sharoushi-net.com/business/subsidy/post_5.html,埼玉県さいたま市上落合2-3-2 mio新都心,,https://www.sharoushi-net.com/contact/
司法書士・行政書士・土地家屋調査士 川崎事務所,http://www.kawaoffice.com,愛知県尾張旭市 向町三丁目2番地12,,https://www.kawaoffice.com/contact/
安陵測量登記事務所,http://yasuoka-office.com,岐阜県本巣郡北方町高屋伊勢田一丁目64番地,,https://yasuoka-office.com/contact.html
桜行政書士法人・桜社会保険労務士事務所・さくら京都合同会社,http://www.sakura-kyoto.net,京都府京都市中京区油小路通竹屋町下ル橋本町487-16,,https://www.sakura-kyoto.net/#%E3%81%8A%E5%95%8F%E5%90%88%E3%81%9B
山田法務行政書士事務所 所在地,http://solicitoryamada.web.fc2.com/,神奈川県伊勢原市東成瀬46-2-14-606,,https://solicitoryamada.web.fc2.com/yso/contact.html
行政書士　青崎法務事務所,http://aosaki.com/,福岡県福岡市博多区御供所町1-18　リビング博多ビル　4-C,,https://aosaki.com/contactus/
前原正人行政書士事務所,http://maehara-office.com/index.html,沖縄県那覇市泉崎2丁目1番地4 大建ハーバービューマンション501号室,,https://maehara-office.com/contact/
コンドー行政書士事務所,http://kondoj.com/,東京都港区芝大門2-4-4中根ビル9F,,https://kondoj.com/contact/
プレシャス総合法律事務所,http://precious-law.jp,東京都新宿区四谷4丁目3番地,,https://precious-law.jp/contact/
フェイス総合法務事務所,http://www.ksconsul.jp,神奈川県横浜市保土ケ谷区常盤台86番地,,https://www.ksconsul.jp/contact/
行政書士佐藤隆廣事務所,http://gyouseimie.client.jp,三重県員弁郡東員町笹尾西二丁目22番11,,https://gyouseimie.client.jp/contact.html
リーフ法務事務所,http://leaflegal.net,大阪府吹田市広芝町4-34　江坂第一ビル4F,,https://leaflegal.net/contact/
行政書士ゆうだい法務事務所,http://www.g-youdai.com,山口県熊毛郡平生町竪ケ浜367-1,,https://www.g-youdai.com/contact.html
行政書士玉田事務所,http://www.visa-aichi.com/,愛知県稲沢市駅前２－４－４スカイル２１　１０１,,https://www.visa-aichi.com/contact/
サニー行政書士事務所,http://www.sunnygyosei.com/,東京都八王子市別所2-35-12,,https://www.sunnygyosei.com/contact/
行政書士法人Climb,http://www.client-partners.jp/,東京都新宿区高田馬場1丁目17-16　スタープラザ高田馬場8Ｆ,,https://www.client-partners.jp/contact/
ヘリテージ行政書士事務所,http://heritage-souzoku.com/,大阪府大阪市北区堂山町1-5 三共梅田ビル6階センターオフィス15号,,https://heritage-souzoku.com/contact/
行政書士事務所 アイズオフィス,http://isoffice.web.fc2.com,東京都荒川区西尾久7-12-4,,https://isoffice.web.fc2.com/contact.html
行政書士法人長澤事務所,http://www.office-nagasawa.com,埼玉県熊谷市筑波3-67 パレスクラシーゼ201,,https://www.office-nagasawa.com/form/office-nagasawa/contact
行政書士佐藤秀樹事務所,http://www.hideki-office.com/,北海道札幌市中央区南１０条西１４丁目１－２５,,https://www.hideki-office.com/contact/
奈良社会保険労務士・行政書士事務所,https://www.office-nara.jp/,山口県山口市宮野下30,,https://www.office-nara.jp/contact/
木下税理士事務所,https://www.kinonet.jp/gyouseisyosi.html,山口県宇部市明治町一丁目8-11,,https://www.kinonet.jp/contact.html
三輪行政書士事務所,http://miwa-office.com/,山口県防府市松原町5-30,,https://miwa-office.com/contact/
行政書士法人青森総合法務事務所,http://shakoshoumei.jp/,青森県青森市浜田豊田509,,https://shakoshoumei.jp/contact/
赤石行政書士事務所,https://akaishi-gyousei.jp/,青森県青森市浪岡大字浪岡字平野１３７番地３９,,https://akaishi-gyousei.jp/contact-2/
行政書士 逸見正事務所,https://www.htoffice.jp/,山形県山形市小立2-7-1,,https://www.htoffice.jp/contacts/
行政書士佐藤陽介事務所,https://www.yamagata-shakoshoumei.com/,山形県天童市大字矢野目2529番地の2,,https://www.yamagata-shakoshoumei.com/%E3%81%8A%E5%95%8F%E3%81%84%E5%90%88%E3%82%8F%E3%81%9B/
行政書士法人きずな神戸,http://www.kizuna-group.com/,兵庫県神戸市東灘区魚崎浜町27-21（神戸印刷センター本館4階）,,https://www.kizuna-group.com/contact
Green行政書士事務所,http://car-manual-fxxk.com/,香川県高松市香西東町 278-1-2F,,https://car-manual-fxxk.com/contact/
行政書士谷口法務経営事務所,https://www.tanikei-soudan.jp/,茨城県石岡市石岡２２０６－1,,http://www.tanikei-soudan.jp/%E3%81%8A%E5%95%8F%E3%81%84%E5%90%88%E3%82%8F%E3%81%9B/
いしがみ敦子法務事務所,http://ishigami-legal.info/,茨城県牛久市柏田町　3047-22,,https://ishigami-legal.info/contact.html
加藤亜希行政書士事務所,http://kato-aki.com/,三重県鈴鹿市柳町1706番地の1,,https://kato-aki.com/contact/
行政書士やまぐち事務所,https://gyousei-yamaguchi.com/,三重県伊勢市小俣町明野290-8,,https://gyousei-yamaguchi.com/menu/contact/
行政書士はぎわら事務所,http://kensetsugyou.biz/,埼玉県新座市野火止5-1-20 アーバン201,,https://kensetsugyou.biz/%e3%81%8a%e5%95%8f%e5%90%88%e3%81%9b%e3%83%95%e3%82%a9%e3%83%bc%e3%83%a0/
行政書士つむぐ法務事務所,https://kensetsugyoukyoka-soudan.com/,埼玉県越谷市赤山本町6番地9－1階,,https://kensetsugyoukyoka-soudan.com/contact-us/
行政書士諸井佳子事務所,http://moroi-office.com/,埼玉県上尾市原市中3-6-16 シルクロード原市101,,https://moroi-office.com/nktt/contact/
行政書士法人地域交通プラネッツ,http://www.ck-planets.jp/,宮城県仙台市宮城野区扇町3丁目2番25号,,https://www.ck-planets.jp/contact/
行政書士宮城中央事務所,https://www.kuruma-sendai.jp/,宮城県仙台市若林区荒井7丁目2-8,,https://www.kuruma-sendai.jp/%E3%81%8A%E5%95%8F%E5%90%88%E3%81%9B/
黒田行政書士事務所,https://gyousei-kuroda.com/,宮城県仙台市泉区南光台2丁目11番64号,,https://gyousei-kuroda.com/home/contact/
ミツノブ行政書士事務所,https://www.mitsunobu-gyosei.com/,東京都世田谷区北沢3-6-12-101,,https://www.mitsunobu-gyosei.com/contact
ありすEP行政書士オフィス,https://alice-ep.com/,東京都大田区下丸子2-13-5-516,,https://alice-ep.com/contact/
川邉行政書士事務所,https://kawabeyr.com/,東京都大田区西六郷４－３０－７　音金六郷マンション１Ｃ,,https://kawabeyr.com/contact/
東京下町事務所,http://tokyo-shitamachi.net/,東京都江東区富岡1丁目12番6号,,https://tokyo-shitamachi.net/inquiry/
Clefarray Factory,https://beans-g.jp/,東京都江東区東陽2-4-39 新東陽ビル4F 31号室,,https://beans-g.jp/contact/
司法書士法人ヤマト,https://www.yamato-legal.com/,大阪府大阪市北区梅田1丁目2番2 大阪駅前第2ビル11Ｆ12号,,https://www.yamato-legal.com/contact/index.html
行政書士こんどう法務事務所,https://office-kondo.net/,大阪府寝屋川市昭栄町１７番１３号,,https://office-kondo.net/contact/
アイノン行政書士事務所,https://www.of-ishikawa.com/,沖縄県うるま市安慶名1-8-55 安慶名店舗10,,https://www.of-ishikawa.com/contact/index.php
税理士常住事務所,https://www.tsunezumi.jp/,東京都北区赤羽西1-5-1-606 アビレ・赤羽アボードIビル内,,https://www.tsunezumi.jp/cms/contact
あさひ行政書士・社会保険労務士事務所,https://www.asahi-shinsei.com/,東京都東久留米市本町1－4－22－503,,https://www.asahi-shinsei.com/contact
司法書士・土地家屋調査士・行政書士前原事務所,http://maehara-j.com/,東京都中野区中野四丁目３番１号オフィスサンクォーレ３０３号,,https://maehara-j.com/page-193/contact/
行政書士エスポワール法務事務所,http://tokyo-espoir.com/,東京都中野区本町6-27-12　豊国ビル401号室,,https://tokyo-espoir.com/inquiry
株式会社リサーチセンター,http://researchcenter.co.jp/,岐阜県羽島郡岐南町八剣北4-111 奥田ビル3階,,https://researchcenter.co.jp/%e3%81%8a%e5%95%8f%e3%81%84%e5%90%88%e3%82%8f%e3%81%9b/
野上司法書士事務所,https://nogamitakuji.jimdofree.com/,岡山県岡山市北区久米267番地26,,https://nogamitakuji.jimdofree.com/%E3%81%8A%E5%95%8F%E3%81%84%E5%90%88%E3%82%8F%E3%81%9B/
真行政書士事務所,http://makoto-gyouseishoshi.com/,岡山県岡山市中区江崎11番地8葦原ビル3階301号,,https://makoto-gyouseishoshi.com/contact-us/
さいとう行政書士事務所,http://saitou-gyousei.com/,岡山県岡山市北区惣爪１４番地６,,http://saitou-gyousei.com/contact/
税理士法人日暮里総合事務所,https://nippori-sogo.com/,東京都荒川区西日暮里２－２０－１ ステーションポートタワー３階,,https://nippori-sogo.com/%e3%81%8a%e5%95%8f%e3%81%84%e5%90%88%e3%82%8f%e3%81%9b/
独立コンサルAJ行政書士事務所,https://kensetukyoka.org/,東京都荒川区東尾久5-12-10-301,,https://kensetukyoka.org/contact.html
行政書士田中事務所,https://www.k-tanaka-office.jp/,京都府京都市伏見区竹田向代町36-1,,https://www.k-tanaka-office.jp/contact
行政書士 服部行政法務事務所,http://www.gyoseihoumu.com/,京都府京都市下京区上平野町460番地２,,https://www.gyoseihoumu.com/contact.html
行政書士法人Asumia,https://e-jimusho.com/,広島県広島市東区光町2丁目6番41号　セネスビル4階,,https://e-jimusho.com/contact/
三品行政書士事務所,http://www.msn-office.com/,広島県福山市若松町4-21,,https://www.msn-office.com/contact/
行政書士沖元事務所,https://www.okimoto-gyousei.com/,広島県広島市南区皆実町五丁目１番３７－１７号,,https://www.okimoto-gyousei.com/%E3%81%8A%E5%95%8F%E3%81%84%E5%90%88%E3%82%8F%E3%81%9B/
税理士法人ウィズラン,https://withrun.co.jp/,長崎県佐世保市木場田町8-6,,https://withrun.co.jp/#contact
行政書士中村法務経営事務所,http://www.gyosei-nakamura.com/,長崎県長崎市赤迫３丁目６番３４号,,https://www.gyosei-nakamura.com/contact/
小寺行政書士事務所,http://kodera.biz/,新潟県上越市栄町７番６号３Ｆ,,https://kodera.biz/contact/
Asocia行政書士法務事務所,https://fumio-h-office.com/,新潟県新潟市西区平島2丁目13-11 2F,,https://fumio-h-office.com/contact/
佐藤栄作行政書士事務所,http://www.sato-eisaku.jp/,東京都足立区綾瀬4-13-20 ドルフ綾瀬103,,https://www.sato-eisaku.jp/contact/
静野行政書士事務所,https://shizuno-office.com/,長野県長野市三輪9-43-18-1F,,https://shizuno-office.com/contact/
かすや法務行政書士事務所,http://www.gyousei-kakogawa.com/,兵庫県加古川市加古川町平野343番地　橋本ビル202号,,https://www.gyousei-kakogawa.com/inquiry.html
ディライト行政書士事務所,http://delight-gyousei.com/,兵庫県姫路市飾磨区加茂198-1-908,,https://delight-gyousei.com/contact/
行政書士稲葉事務所,http://i-kaisha-setsuritsu.com/,兵庫県芦屋市大桝町7番9-402号,,https://i-kaisha-setsuritsu.com/contact/
行政書士法人MOYORIC（モヨリック）,https://office-tsuda.net/,兵庫県神戸市東灘区向洋町中6丁目9番地  神戸ファッションマート6F,,https://office-tsuda.net/contact
行政書士とやま事務所,http://gyosei-toyama.com/,神奈川県横浜市神奈川区六角橋2丁目14－2 クレインビル305,,https://gyosei-toyama.com/contactus/
行政書士法人Withness,https://www.kumamoto-kensetsu.com/,熊本県熊本市中央区新大江1丁目7-45　2F,,https://www.kumamoto-kensetsu.com/contact/
行政書士森本法務事務所,http://morimoto-office.com/,熊本県熊本市中央区南熊本1丁目3番24号,,https://morimoto-office.com/contact/
行政書士コヤマ事務所,https://www.ofnon.com/,群馬県高崎市請地町６－８,,https://www.ofnon.com/contact
行政書士事務所Office Arai,http://office-arai-gunma.com/,群馬県前橋市亀里町1299番地7 エスコンビル2F,,https://office-arai-gunma.com/inquiry/
西村土地家屋調査士・行政書士事務所,https://www.office-nk.com/,滋賀県長浜市五村２１５番地,,https://www.office-nk.com/%E3%81%8A%E5%95%8F%E3%81%84%E5%90%88%E3%82%8F%E3%81%9B/
うらやす行政書士こうら事務所,https://kourajimusyo.com/,千葉県浦安市北栄4-21-1-102,,https://kourajimusyo.com/contact.html
宮本会計事務所,https://www.m-zei.jp/,千葉県千葉市中央区弁天1-2-8 四谷学院ビル（旧：千葉CTビル）4階,,https://www.m-zei.jp/contact.html
西馬行政総合事務所,http://nishiuma.sakura.ne.jp/,大分県別府市上原町11番30号,,https://nishiuma.sakura.ne.jp/contact.html
税理士法人羽生会計事務所,http://h-fledge.jp/,大分県別府市楠町19-12,,https://h-fledge.jp/contact.html
さむらい行政書士法人,https://samurai-law.com/,東京都豊島区池袋1-1-3豊ビル7階,,https://samurai-law.com/contact/
行政書士法人ふたば,http://g-futaba.jp/,東京都豊島区南池袋1-16-15 ダイヤゲート池袋5階,,https://g-futaba.jp/contact
大矢社会保険労務士・行政書士事務所,https://www.ooya-sr.net/,新潟県新潟市中央区万代3-1-1 新潟日報メディアシップ12階,,https://www.ooya-sr.net/contact/
のばら行政書士事務所,http://www.nobara-gyousei.com/,新潟県新潟市秋葉区北上新田376番3号 菜の花 2階2号室,,https://www.nobara-gyousei.com/contact/#form
ストレート行政書士事務所,http://www.kensetsukyoka.tokyo/,東京都日野市豊田3丁目40番地の3レジェイドサザンゲート1階,,https://www.kensetsukyoka.tokyo/contact/
リーガルコンサルティング行政書士事務所,https://www.leco-gyosei.com/,神奈川県川崎市  川崎区藤崎1-21-12,,https://www.leco-gyosei.com/contact
司法書士・行政書士彩の森事務所,http://sainomori.jp/,埼玉県入間市豊岡1-3-26,,https://sainomori.jp/contact_us/
行政書士・社会保険労務士とみの法務事務所,https://car-kitaq.com/,福岡県北九州市小倉北区上富野五丁目8番14号,,https://car-kitaq.com/contact/
アモンド法務事務所,http://amondo.jp/,大阪府堺市堺区中安井町３丁４番１０号　堺東八千代ビル６F,,https://amondo.jp/contact.html
シャイン司法書士法人行政書士事務所,http://osaka-kyoninka.com/,大阪市中央区大手前一丁目７番３１号 ＯＭＭビル１２階,,https://osaka-kyoninka.com/#contact
瀬戸口行政書士事務所,http://aiza.jp/,大阪府堺市南区原山台1-6-1 原山台C団地 1F,,https://aiza.jp/contact
VALL行政書士法人,https://www.kensetsugyou-support.com/,東京都港区西新橋2丁目18番1号弁護士ビル2号館406,,https://www.kensetsugyou-support.com/inquiry/
コンチネンタル国際行政書士事務所,https://continental-immigration.com/,東京都港区赤坂2-16-6 BIZMARKS赤坂,,https://continental-immigration.com/contact/
行政書士まき事務所,http://mukae.me/,埼玉県熊谷市久保島2305番地,,https://mukae.me/contact/
渡辺行政書士事務所,http://take-nabe.jp/,埼玉県熊谷市筑波2-20 木村ビル3F 熊谷オフィス,,https://take-nabe.jp/contact/
行政書士寺主事務所,https://teraji-office.net/,香川県丸亀市西本町1丁目3番34号,,https://teraji-office.net/contact/
行政書士 柿崎崇 事務所,http://kakijimu.com/,秋田県秋田市外旭川字大畑５９番地９,,https://kakijimu.com/contact.html
行政書士法人アドミンイノベーション,https://www.miyamoto-offices.com/,熊本県熊本市北区龍田陳内3-3-55,,https://www.miyamoto-offices.com/%E3%81%8A%E5%95%8F%E5%90%88%E3%81%9B/
だんだん行政書士事務所,https://www.dandangyouseisyosi.com/,島根県松江市東朝日町206-7,,https://www.dandangyouseisyosi.com/%E3%81%8A%E5%95%8F%E3%81%84%E5%90%88%E3%82%8F%E3%81%9B/
